left-primer-target-sequences	right-primer-target-sequences	guide-target-sequences
CATTCCCTAGTAACATGATGGTTGTAACTG CATTTCCTAGCAATATGATGGTAGTTACGG CCTTTCCAAGCAATATGATGGTTGTCACAG	TGGCACCACAATTCAGCAAGCATAGGGGAA TGGCACCACACAAGTGATGATTTCGGTGAG	AACGTGAACAAAAAGAGAGCCTTCTTCA ACAGAAGGAAAGCCTCTTGCACCAGGCG ACGTGAACAAAAAGAAAGCTTATTGCAT
TACTTCAAATGACCCCTTCACATTACTCAG TCCTTCAAATGACACCTTCTCATTATTCAG TGCTTAACTTTTTACCTACTCACTACTCAG TTCTCCAAATGACACCCTCACATTACTCCG	ACATTCCTTTATGGCAAATAGGATGAGCAA GCACTCATTTATGGCGAATCGCATGAGCAA TCACTCCTTTATGGCTAACCGCATGAGTAA TCATTCTTTCATGGCCAATCGTATGAGTAA	GTACATCGGTATAATGACCAATACAGCC TGTTCATAGGTACAACGATCAATACAGT
ACCTTGACCATCCTCCACTTTTCTCAACCA ACTTTGATCATCCTCCCTTATTCTCCACCA ATCTTAATCACCCTCCGTTATTCTCTACAA ATTTGGATCATCCTCCATTATTCTCCACGA TTGTGGAGCATGAACCTCTTTTTTCAACTA	AGTGTTGGGACAGTGTCTTCGATAGAAGTG CATGCTGGGATGCAGTATTCGAGCCTAATG CCTGTTGGGATGCAGTCTTTGAGCCTAATG	TAGTGACTTAAGTATTTTTATAAAAGAC TTAGTGACTTGAGTATTTTCATTAAGGA
AATTGCCACAGATGTACCATCAGCAACAAA AGTAGCAACTGATGTACCAACGGCAACCAA AGTATCTACTGATATCCCATCTGCAACAAA AGTGGCAACTGACGTGCCATCTGTGACTAA AGTTGCTGATTCCCCTTTGGAGGCATCCAA	AAGCTGGAGAATGGGCTGAAAATTGCTACA CAGAAGGGGAGGAAGCCAAAACATGCTACA	AGATGGGGATTCCGAGCCGGTGTTCCAC ATGGGCCTTCAGGGCAGGTGTACCTCCC CCGGTGTCCCACCAAAGGTGGTCAATTA TTCAGGTGTGCCTCCCAAGGTGGTCAGC
ATGTATGATCACTTGCCTGGTTTTGGAACT ATGTATGATCATCTCCCAGGTTTTGGGACA TTGTTCACCCATCTACCCGGCAATAACACT	AAGGAGAGAATGCTCAGGCGGCATTAACTC AGGGAGACTCCCCCCAGTGTGCATTAATCC ATGGAGACTCTCCTCAATGTGCCCTCATTC ATGGTGACTCTCCCCAATGTGCACTCATAC	CATTATTCATGCTGAGTTCCAGGCCAGC CTTGATGTAATTCATGCAGAATTTCAGG
CAACCTAGCCCGACATGGAGAATACGCACC CTCACTAGCACAACATGGAGAATATGCCCC CTCACTTGCTAAGCATGGGGAATATGCCCC CTCCCTGGCCAAGCATGGAGAGTATGCTCC	GAAGCAGCCACTGAGGCCGAAAAGCAGTTG GAGGCGGCACATGATGCAGAGGTAAAACTA GAGGCTGCCACTGAGGCTGAGAAGCAACTC	AACCTTTCTGGAGTAAATAATCTTGAGC GCCTTCTCAATCTCTCGGGAGTTAACAA GCTGGGTGTGGCAACAGCACACGGCAGC TGCTGAATCTATCTGGGGTTAACAATCT
CAATTGGATGCATTATACGATACCGCAATG CGATTGGATGCACTTTTTAATACCACTATG TAATTGGATGCACTACACTATACCACAGTG TAATTGGATGCATTATACAATCCCACAGTG TGATTGGATGCACTTCCTAATTCCGCAATG	ACAAAAACTCTGGACAAGTATTTCATGTGC ACAAAAACTGTGGACGAGTATATCCTGTGC ACAAAAGTTATGGACTAGTATCTCATGTGC ACAGAAATTGTGGACATGTATATCATGTGC	ATGCATGTAAGTGATTATTATAATCCGC TTATATGCATGTCAGTGATTTTTATAGC
ACAATTACCTCAATCACTGAAAACTGCTAC CCAATTGCCTCAGTCCCTTAAAACGGCTAC TCAACTGCCACAATCATTGAAAACAATGGC TCAATTACCTCAATCACTCAAGACAGCAGC TCAATTGCCACAATCACTCAAGACTGCTAC	TAGCCAGTATTGGTACATCCTTTGAGAGAG TAGCTAGCATAGGCACGGCTTTTGAAAGAT TGGCTAGTATAGGAACTGCTTTTGAGCGAT TTGCCAGTATTGGAACTGCCTTCGAACGTG	CTCTATCTTTGATGACCTTCAAGGTTCT GCTATCTTTGATGATCTTCAAGGGACAC TGATGCAATTTTTGATGATCTTCAAGGG
AGGGGATGTCAGAAATGTTGGCCAAATACG GATCCTGTGCAGAGATGGTGGCCAAATATG GCAGTTGTGCCGAAATGGTTGCAAAATATG GCGCATGTTCAGAGATGGTGGCAAAGTATG GGGTTTGTGCTGAGATGGTTGCAAAATATG	GCAACCGCTGCGGCAACTGAGGCTTATTGG GCACCAGCTGCTGCCTTTGATGCTTACTTA GCCACTGCTGCAGCTACTGAAGCATACTGG TCAACTGCAGCTGCAGTAGATGCGTACTGG	TCCTGGTGATGACAACTGGCCGCGCAAC TTCTGGTGATGACAACCGGTCGGGCAAC
AGCTTTGACTCAACTACGGCCGCCATCATG AGCTTTGACTCTACCACTGCTGCTATCATG AGTTTTGACTCAACAACAGCTGCAATTATG CCTTTAGCTCATACTGTGGCTGCATTGCTC	AAAACCTCCAATCCGCTTGTGAGAATCAAT AAGATATCTAACCCGCTGGTACGTGTCAAC AAGGCAACCAATCCGCTTGTCAGAGTCAAT AAGGCCAACAACCCCCTCGTTAGAGTGAAT CACAACGGGCAAAAATTTGTCCGTGTCAAT	TGGCATCATATACAATCACTCACTTTGG TTGCTTCATATACTATCACCCATTTCGG
