objective-value	target-start	target-end	target-length	left-primer-start	left-primer-num-primers	left-primer-frac-bound	left-primer-target-sequences	right-primer-start	right-primer-num-primers	right-primer-frac-bound	right-primer-target-sequences	num-guides	total-frac-bound-by-guides	guide-set-expected-activity	guide-set-median-activity	guide-set-5th-pctile-activity	guide-expected-activities	guide-target-sequences	guide-target-sequence-positions
3.5963294016151064	384	590	206	384	1	0.9259259259259259	CAGTGTTCTAGCCTGCGTGGCTGCCTGCAC	560	1	0.9153439153439153	GCAATTGCGGGATGGGACCAACTACTTTGG	2	0.9682539682539683	2.643785541335111	2.7739957571029663	1.5913305282592773	2.156068983216765 2.1450223556902044	TCGCGTGTGCTCATCTTGAGTCCTCCGG TGGCTAACCTTAACCCTGCAGCTAGAGT	{463} {501}
1.5860388885604486	688	864	176	688	3	0.9470899470899471	GGGCGCACAAGTCTCCAGACAGAATGTTGG GGGCGCTCAGGTATCTAGACAGAATGTTGG GGGTGCACAGGTTTCCAGACAAAATGTTGG	834	3	0.9047619047619048	CAAGTAAATTTACTGACCCAGTCAAAGATG CAAGTAAATTTACTGATCCTGTTAAAGATG CTAGCAAATTCACAGACCCAGTTAAAGATG	2	0.9947089947089947	2.550534137342342	2.5916162729263306	1.9777965545654297	2.25517503609733 2.1157867082212336	GTTTAAATTATTTTAACATCAATTATTT TCAATTACTTTAAGGATGCTGCCTCGAG	{756} {774}
0.5121545296096022	3662	3872	210	3662	3	0.9047619047619048	CATATACCGAACAAACACTACAGGTGATGA CATTTACCGAACAAACACCACAGGTAATGA CATTTACCGCACAAACACTATAGGTGATGA	3842	5	0.9047619047619048	TGAAGGACCATGTGAACCTGGAGATTGTGG TGAAGGACCTTGTGAACCAGGTGACTGTGG TGAGGGACCATGTGAACCAGGTGATTGTGG TGAGGGACCATGTGAGCCTGGTGACTGTGG TGTGGGACCCTGCAAACCAGGTGATTGTGG	2	0.9576719576719577	2.569359202233572	2.713167190551758	1.3819286823272705	1.9963283068919309 2.0020210897481	GAGTGAATATTACCCAAAACATATACAA TTGGTATGAAATTCAAGAAAGTGAATAC	{3797} {3779}
-0.8466569526955698	7353	7486	133	7353	6	0.9047619047619048	GGACAAAGAAACCATCTCAGATGCAGGAGC GGACAAAGAACCCATCATGCATGCAGGAGC GGACCAAAAAACCTTCACAGATGCAAGAAC GGACCAAGAACCCCAGAAACATGCAAGAAC GGACTAAGAAACCCTCACAAATGCAGGAAC GGACTAAGAACCCTTCATGTATGCAAGAAC	7456	5	0.9206349206349206	CAGCGTTAGCGCTGGACGCGCGCTGTATAT CAGTGTATCTGCTGGTCGGGCACTGTATAT CAGTGTCAGCGCTGGTCGTGCACTGTATAT CAGTGTTAGTGCTGGTCGCGCACTGTATAT GAGCGTTAGCGCTGGACGTGCACTATATAT	2	0.9365079365079365	2.4507991870244346	2.6843546628952026	0.0	2.2401228411487804 1.8923332255984109	CCTGTGTCACTTAATGTGGCATAATGGG TGTCATTTAATGTGGCATAATGGTAGAG	{7393} {7397}
-1.0134531399573454	1116	1248	132	1116	5	0.91005291005291	CAAAAGGATGGTGGTGGAAATTACCAGATG CATCTGGCTGGTGGTGGAAATTACCTGATG CCAAGGGTTGGTGGTGGAAACTACCTGATG CTAAAGGATGGTGGTGGAAGTTGCCTGATG CTAAGGGGTGGTGGTGGAAACTTCCAGATG	1218	6	0.9153439153439153	ACGTGCAATGCAACGCTAGCAAATTCCACC ACGTGCAGTGCAATGCAAGCAAATTCCATC ATGTACAATGCAATGCTAGCAAATTTCATC ATGTACAATGTAATGCTAGCAAGTTTCACC ATGTGCAGTGTAATGCTAGTAAATTCCATC ATGTTCAGTGTAATGCAAGTAAATTTCATC	2	0.8994708994708994	2.2790281104032326	2.580931305885315	0.0	1.5818298657735188 1.4607395570744912	CATTTTTGGTGAAAATATGTTTTATCAC GCCAAAACATGTATTACCATTTCTTGGG	{1162} {1170}
-1.130116716770341	3080	3248	168	3080	9	0.91005291005291	CCAATACATGTTTGTCCCACCAGGGGCTCC CCAGTACATGTATGTGCCTCCTGGTGCTCC GCAATACATGTATGTACCACCAGGTGCACC GCAATACATGTATGTACCACCTGGGGCTCC GCAATACATGTATGTCCCTCCTGGAGCTCC GCAATATATGTATGTACCCCCAGGAGCACC GCAATATATGTATGTACCTCCAGGAGCCCC GCAGTATATGTATGTCCCACCAGGTGCTCC TCAATACATGTATGTACCCCCGGGAGCACC	3218	2	0.9259259259259259	AGCCTCAGCATACTACATGTTTTATGATGG TGCATCAGCTTATTACATGTTTTATGATGG	2	0.9576719576719577	2.308605158770526	2.3963807821273804	1.4236526489257812	1.8757889929902616 1.7782694716302176	TAGGGATGATTATGCATGGCAATCAGGC TTGCTTGGCAATCAGGCACCAATGCATC	{3122} {3133}
-1.6530162888815436	1600	1761	161	1600	8	0.9047619047619048	CAAGTGATGACAATTGGCTAAACTTTGATG CCACAGAAGAGTACTGGCTCAATTTTGATG CCACTGAAGAATATTGGCTGAATTTTGATG CCAGTGATGAAAATTGGTTAAATTGTGATG CTACTGATGAAAGCTGGCTGAACTGTGATG CTAGTGATGATAATTGGCTAAATTTTGATG CTAGTGATGATAGCTGGCTTAATTTTGATG CTAGTGATGATGCATGGCTCAATTTTGATG	1731	3	0.9047619047619048	ATGGACTCAATGCTCAGACACAACAACTGG ATGGATTCAATGCTTAGACATAATAATTGG ATGGATTCTATGGTTAGGCACAACAACTGG	2	0.8253968253968254	1.7615365818064048	2.007757782936096	0.0	1.3331957866275121 1.1562737699538943	CTTTGATAGTACCATATGTGAATGCTGT TCATCAATCTCAGAAGCAATAATTCGGC	{1699} {1669}
-1.6661704608606565	6841	7012	171	6841	2	0.9735449735449735	GGCATTTGATTATACAAATTATGATGGTAG GGCTTTTGATTACACCAATTATGATGGAAG	6982	9	0.9312169312169312	CTATGAAGTAGAGGGAGGTGTTCCATCTGG CTATGAAGTTGAAGGGGGAATGCCATCAGG CTATGAAGTTGAGGGTGGTATGCCATCAGG CTATGAGGTTGAAGGGGGTGTTCCATCTGG TTATGAAGTGGCAGGTGGAGTTCCTTCTGG TTATGAAGTTGAAGGAGGTGTGCCATCTGG TTATGAAGTTGAAGGGGGGGTGCCATCAGG TTATGAGGTTGAAGGTGGAGTCCCATCAGG TTATGAGGTTGAGGGAGGGGTGCCATCAGG	2	0.8148148148148148	1.7824335057268699	1.9703874588012695	0.0	1.1206983239562422 1.4479458984874545	AAAAATTATGTAACTCCAAACACATATT ATAGATTATGTAAATCAAAACACATCTT	{6942} {6942}
-1.840880179786275	4733	4874	141	4733	4	0.91005291005291	ATACTTTGATGGATACGACCAACAGAGTGT ATACTTTGATGGATATGATCAGCAAAGTGT ATATTTTGATGGGTATGATCAACAGAGTGT ATATTTTGATGGTTATGACAATCAGAGTGT	4844	8	0.9047619047619048	CATACCACCAATGGCTGATCTACCAGATAA CATACCTCCAATGGCTGATCTACCTGATAA CATACCTCCTATGGCAGATCTGCCAGATAA TATACCACCAATGGCTGATCTTCCAGACAA TATACCACCAATGGCTGATTTACCAGATAA TATACCACCTATGGCTGACCTACCAGATAA TATACCACCTATGGCTGATTTACCAGACAA TATTCCTCCAATGGCTGACTTACCAGATAA	2	0.9841269841269841	1.994082320934881	1.9450385570526123	1.3394241333007812	1.6091116017134732 1.4695101724099862	ACATTATGCAAAATCCAAGTGGGGAAGA ATATTATGCAAAACCCTGGTGGTGAGGA	{4777} {4777}
-2.8628272993349677	5992	6110	118	5992	7	0.9047619047619048	AACAGCAAGAATGATCAAATACAATTACCC AACAGCACGAATGCTTAAATATAACTATCC AACAGCTAGAATGCTTAAATATAATTACCC AACTGCCAGAATGATCAAGTATAACTATCC AACTGCTAGGATGCTTAAATACAACTATCC GACAGCTAGAATGCTCAAGTACAACTATCC TACTGCACGAATGATCAAGTACCATTACCC	6080	7	0.9047619047619048	CATGTAGGAGGCAATGGAAGAGATGGGTTC CATGTAGGGGGAAATGGTAGAGATGGATTT CATGTGGGAGGAAATGGAAGGGATGGTTTT CATGTTGGAGGAAATGGGAGAGATGGATTC CATGTTGGGGGTAATGGTAGAGATGGTTTC CATGTTGGTGGCAATGGCAAGGATGGGTTT CATGTTGGTGGTAATGGAAGAGATGGATTT	2	0.8201058201058201	1.8516679494469255	2.1175061464309692	0.0	1.3942254223520794 1.0117586371759888	ACAAAATCAGGATATTGTGGTGGTGTTT TACTATACAAAATTGGCCAAGTTCTGGG	{6023} {6048}
