objective-value	target-start	target-end	target-length	left-primer-start	left-primer-num-primers	left-primer-frac-bound	left-primer-target-sequences	right-primer-start	right-primer-num-primers	right-primer-frac-bound	right-primer-target-sequences	num-guides	total-frac-bound-by-guides	guide-set-expected-activity	guide-set-median-activity	guide-set-5th-pctile-activity	guide-expected-activities	guide-target-sequences	guide-target-sequence-positions
3.5963294009843696	385	591	206	385	1	0.9259259259259259	AGTGTTCTAGCCTGCGTGGCTGCCTGCACA	561	1	0.9153439153439153	CAATTGCGGGATGGGACCAACTACTTTGGG	2	0.9682539682539683	2.643785540704374	2.7739957571029663	1.5913305282592773	2.156068981955291 2.1450223556902044	TCGCGTGTGCTCATCTTGAGTCCTCCGG TGGCTAACCTTAACCCTGCAGCTAGAGT	{463} {501}
1.0524065745291167	687	864	177	687	3	0.9629629629629629	TGGGCGCACAAGTTTCCAGACAGAATGTTG TGGGCGCTCAGGTATCTAGACAGAATGTTG TGGGTGCACAAGTATCTAGACAAAATGTTG	834	4	0.9153439153439153	CAAGCAAATTCACTGACCCAGTTAAAGATG CAAGTAAATTTACAGACCCAGTTAAAGATG CTAGCAAATTTACTGACCCAGTTAAAGATG CTAGTAAATTTACTGATCCAGTTAAAGATG	2	0.9947089947089947	2.519997754424968	2.5456517934799194	1.7977173328399658	2.25517503609733 1.8606994019614325	GTTTAAATTATTTTAACATCAATTATTT TTTAATATAAATTACTTTAAGGATGCTG	{756} {767}
0.9560634782810187	3661	3811	150	3661	3	0.9047619047619048	TCATATACCGAACAAACACTACAGGTGATG TCATTTACCGAACAAACACCACAGGTAATG TCATTTACCGCACAAACACTATAGGTGATG	3781	4	0.91005291005291	GGTATGAAATACAAGAAAGTGAATATTACC GGTATGAAATTCAAGAATCAGAATATTACC GGTATGAAATTCAAGAGAGTGAGTACTATC GGTTTGAAATACAAGAGAGTGAGTACTACC	2	0.9629629629629629	2.329026752363437	2.4194449186325073	1.09218168258667	1.7566654953376326 1.593201738501352	ACTATATTCCAACATGTGATTGCACAGA GTATTACTGTAAACATAAGGATAGATAT	{3691} {3725}
-1.0425731303601316	1116	1251	135	1116	4	0.91005291005291	CAAAAGGTTGGTGGTGGAAATTACCAGATG CAAAGGGATGGTGGTGGAAGTTGCCTGATG CCAAAGGATGGTGGTGGAAATTACCTGATG CTAAGGGATGGTGGTGGAAGCTACCAGATG	1221	7	0.9047619047619048	TACAATGCAATGCTAGTAAATTCCATCAAG TACAATGTAATTCTAGCAAGTTTCATCAGG TGCAATGCAATGCTAGCAAATTTCACCAGG TGCAGTGTAATGCTAGCAAATTCCATCAAG TTCAGTGCAACGCTAGTAAGTTCCACCAAG TTCAGTGTAATGCAAGTAAATTTCATCAAG TTCAGTGTAATGCTAGCAAATTTCATCAAG	3	0.9788359788359788	2.5146315422638383	2.5527423620224	1.7677040100097656	1.3376192945651908 1.3761785251122933 1.6686091937085308	ATATGGGAATTTTTGGAGAAAATCTATT TATATTTGGAGAAAATATGTATTATCAT TATTTTTGGTGAAAACATGTTTTATCAC	{1155} {1162} {1162}
-1.0453489523620902	3081	3248	167	3081	9	0.9047619047619048	CAATACATGTATGTACCACCAGGTGCACCA CAATACATGTATGTGCCTCCTGGAGCTCCA CAATACATGTATGTTCCCCCTGGAGCACCT CAATATATGTATGTACCTCCAGGAGCCCCT CAATATATGTATGTCCCACCAGGTGCTCCA CAGTACATGTATATACCACCTGGAGCACCA CAGTACATGTATGTACCACCAGGGGCTCCA CAGTACATGTATGTGCCACCAGGAGCACCC CAGTATATGTATGTACCCCCAGGAGCACCA	3218	2	0.9259259259259259	AGCCTCAGCATACTACATGTTTTATGATGG TGCATCAGCTTATTACATGTTTTATGATGG	2	0.9682539682539683	2.3900177942381964	2.4685267210006714	1.6156659126281738	1.7687417259291998 1.8549512861266968	AGAGATGATTATGCATGGCAATCAGGCA TGTTTTCTGGCAACATGGACAACCATAC	{3123} {3161}
-1.2279496957651643	6841	7011	170	6841	1	0.9047619047619048	GGCTTTTGATTATACAAATTATGATGGTAG	6981	9	0.9047619047619048	ACTATGAAGTGGCAGGTGGAGTTCCTTCTG ACTATGAAGTTGAAGGTGGTGTGCCATCAG ACTATGAAGTTGAGGGTGGAGTGCCATCAG ACTATGAGGTTGAGGGAGGTGTTCCATCTG ATTATGAAGTAGAAGGAGGTATGCCATCTG ATTATGAAGTAGAAGGTGGGGTGCCATCAG ATTATGAAGTGGAAGGAGGAATGCCATCAG ATTATGAAGTTGAAGGTGGGGTGCCATCAG ATTATGAGGTTGAAGGAGGGGTGCCATCAG	2	0.783068783068783	1.7173902326160007	1.8621373176574707	0.0	1.4596375797791457 1.111522172809278	ATAGATTATGTAAATCAAAACACATTTT GCCAGTTTAATAGATAGATTATGTAAAT	{6942} {6929}
-1.5797552111300694	7353	7485	132	7353	7	0.91005291005291	GGACAAAGAAACCATCACAAATGCAGGAGC GGACAAAGAACCCAAGATGCTTGCAGGAGC GGACAAAGAACCCCAGAAACATGCAAGAAC GGACTAAAAAACCATCACAGATGCAAGAAC GGACTAAAAATCCATCTCAGATGCAGGAGC GGACTAAGAACCCTTCATGTATGCAAGAAC GGACTAAGAAGCCTTCACAAATGCAAGAAC	7455	5	0.9259259259259259	GCAGCGTTAGCGCTGGACGCGCGCTGTATA GCAGTGTATCTGCTGGTCGGGCACTGTATA GCAGTGTCAGCGCTGGTCGTGCACTGTATA GCAGTGTTGGTGCTGGTCGCGCACTGTATA GGAGTGTTAGCGCTGGACGCGCACTCTATA	2	0.8783068783068783	2.212726039230508	2.4708842039108276	0.0	1.9036284861741242 1.9378347125633684	TCTGTCACTGTGTCATCTAATGTGGCAT TCTGTCATTGTGTCATTTAATGTGGCAC	{7387} {7387}
-2.0415305203186414	1601	1762	161	1601	8	0.9047619047619048	CACTGAAGAATATTGGCTGAATTTTGATGG CACTGATGAAAGCTGGCTAAACTGTGATGG CAGTGATGAAAATTGGCTTAACTGTGATGG CAGTGATGATAATTGGTTAAATTTTGATGG CAGTGATGATGCATGGCTTAATTTTGATGG TAGCGATGATAGCTGGCTTAATTTTGATGG TAGTGATGACAATTGGCTTAATTTTGATGG TAGTGATGATACCTGGCTCAACTTTGATGG	1732	4	0.9047619047619048	TGGACTCAATGTTAAGACATAACAATTGGA TGGACTCTATGCTTAGACACAACAACTGGA TGGATTCAATGCGCAGCCACAACAACTGGA TGGATTCAATGCTTAGACATAATAATTGGA	2	0.8412698412698413	1.873022350369307	2.1637754440307617	0.0	1.2873886237068781 1.1341123155185155	TTTATTAATTTGAGGAGTAATAATTCAG TTTGATAGTACCATATGTGAATGCTGTA	{1668} {1700}
-2.358189598956943	4733	4876	143	4733	5	0.91005291005291	ATACTTTGATGGGTACGACAACCAGAGTGT ATACTTTGATGGTTATGACCAGCAGAGTGT ATATTTTGATGGATATGACCAACAGAGTGT ATATTTTGATGGCTACGATCAACAAAGTGT GTACTTTGATGGGTATGATCAACAAAGTGT	4846	8	0.9047619047619048	TACCACCAATGGCTGATTTACCAGATAAGG TACCACCAATGGCTGATTTGCCTGATAAAG TACCACCTATGGCAGATCTACCAGATAAAG TACCACCTATGGCTGACCTGCCCGATAAGG TACCTCCCATGGCAGATTTACCAGACAAAG TCCCACCCATGGCTGATCTTCCAGATAAAG TTCCCCCAATGGCTGACTTACCAGATAAAG TTCCTCCAATGGCTGATCTACCTGACAAGG	2	0.9312169312169312	1.9855702588797877	2.0500952005386353	0.0	1.6205382649860685 1.4916195941980555	AATGGATGATATCATGCAGAATCCAAGC CATCATGCAAAATCCAAGTGGTGAGGAC	{4769} {4778}
-2.8033063871521726	6004	6105	101	6004	6	0.9153439153439153	GATCAAATACAATTACCCCACTAAATCAGG GATCAAGTACCATTACCCAACAAAAGCTGG GATTAAATACAACTATCCAACAAAAGCAGG GCTCAAGTACAACTATCCAACAAAATCTGG GCTTAAATACAATTATCCAACCAAATCTGG GCTTAAATATAATTACCCAACAAAATCAGG	6075	7	0.9047619047619048	GAATACATGTTGGTGGTAATGGAAGAGATG GAATTCATGTAGGAGGAAATGGTAGAGATG GGATACATGTTGGAGGTAATGGAAGGGATG GGATCCATGTAGGTGGTAATGGTAGAGATG GTATACATGTGGGTGGAAATGGAAGAGATG GTATACATGTTGGGGGTAATGGTAGAGATG GTATTCATGTTGGTGGAAATGGGAGAGATG	1	0.582010582010582	1.036081614002349	1.0405738353729248	0.0	1.036081614002349	TTGTGGTGGGATCTTGTACAAAATTGGG	{6037}
