window-start	window-end	count	score	guide-sequences
0	37	3	0.309434427818608	ATGAGGAATGCTCCTGTTATCCTGATTC GAGGAATGCTCCTGTTACCCAGACACTG TGCTCATGTTATCCTGATACAGGCAAAG
1	38	4	0.22984190768254636	GAATGCTCATGTTATCCTGATACAGGCA GAGGAATGCTCCTGTTACCCAGACACTG GAGGAGTGCTCCTGTTATCCTGATGCCG TGAGGAATGCTCCTGTTATCCTGATTCT
2	39	4	0.23059535769047745	GAATGCTCATGTTATCCTGATACAGGCA GAGGAATGCTCCTGTTATCCTGATGCTG GAGGAATGCTCCTGTTATCCTGATTCTA TCCTGTTACCCAGACACTGGCATAGTGA
3	40	4	0.23056892084809388	AGGAATGCTCCTGTTATCCTGATGCTGG AGGAATGCTCCTGTTATCCTGATTCTAG GAATGCTCATGTTATCCTGATACAGGCA TCCTGTTACCCAGACACTGGCATAGTGA
4	41	4	0.2271056944958494	GAATGCTCATGTTATCCTGATACAGGCA TCCTGTTACCCAGACACTGGCATAGTGA TCCTGTTATCCTGATTCTAGTGAAATCA TGCTCCTGTTATCCTGATGCTGGCGAAA
5	42	4	0.22886374451435518	TCCTGTTATCCTGATTCTAGTGAAATCA TGCTCCTGTTATCCTGATGCTGGCGAAA TGTTACCCAGACACTGGCATAGTGATGT TGTTATCCTGATACAGGCAAAGTAATGT
6	43	4	0.22886374451435518	TCCTGTTATCCTGATTCTAGTGAAATCA TGCTCCTGTTATCCTGATGCTGGCGAAA TGTTACCCAGACACTGGCATAGTGATGT TGTTATCCTGATACAGGCAAAGTAATGT
7	44	4	0.22886374451435518	TCCTGTTATCCTGATTCTAGTGAAATCA TGCTCCTGTTATCCTGATGCTGGCGAAA TGTTACCCAGACACTGGCATAGTGATGT TGTTATCCTGATACAGGCAAAGTAATGT
8	45	4	0.22894305504150583	TATCCTGATACAGGCAAAGTAATGTGTG TCCTGTTATCCTGATTCTAGTGAAATCA TGCTCCTGTTATCCTGATGCTGGCGAAA TGTTACCCAGACACTGGCATAGTGATGT
9	46	4	0.2289430550415058	GCTCCTGTTATCCTGATGCTGGCGAAAT TATCCTGATACAGGCAAAGTAATGTGTG TCCTGTTATCCTGATTCTAGTGAAATCA TGTTACCCAGACACTGGCATAGTGATGT
10	47	4	0.22655052080579494	TATCCTGATACAGGCAAAGTAATGTGTG TCCTGTTATCCTGATGCTGGCGAAATCA TCCTGTTATCCTGATTCTAGTGAAATCA TGTTACCCAGACACTGGCATAGTGATGT
11	48	4	0.2266166129117538	CCTGATACAGGCAAAGTAATGTGTGTTT TCCTGTTATCCTGATGCTGGCGAAATCA TCCTGTTATCCTGATTCTAGTGAAATCA TGTTACCCAGACACTGGCATAGTGATGT
12	49	5	0.18128271559244963	CCTGATACAGGCAAAGTAATGTGTGTTT CCTGATTCTAGTGAAATCACATGTGTGT CTGTTATCCTGATGCTGGAGAAATCATG TGTTATCCTGATGCTGGCGAAATCACAT TTACCCAGACACTGGCATAGTGATGTGT
13	50	5	0.18128271559244963	CCTGATACAGGCAAAGTAATGTGTGTTT CCTGATTCTAGTGAAATCACATGTGTGT CTGTTATCCTGATGCTGGAGAAATCATG TGTTATCCTGATGCTGGCGAAATCACAT TTACCCAGACACTGGCATAGTGATGTGT
14	51	5	0.1806905303230582	CCTGATACAGGCAAAGTAATGTGTGTTT CCTGATTCTAGTGAAATCACATGTGTGT TGTTATCCTGATGCTGGCGAAATCACAT TTACCCAGACACTGGCATAGTGATGTGT TTATCCTGATGCTAGCGAGGTAATGTGT
15	52	5	0.18220271770739704	ACACTGGCATAGTGATGTGTGTATGCAG CCTGATACAGGCAAAGTAATGTGTGTTT CCTGATTCTAGTGAAATCACATGTGTGT TATCCTGATGCCGGCGAAATCACATGTG TTATCCTGATGCTGGCGAAATCATATGT
16	53	5	0.18220271770739704	ACACTGGCATAGTGATGTGTGTATGCAG CCTGATACAGGCAAAGTAATGTGTGTTT CCTGATTCTAGTGAAATCACATGTGTGT TATCCTGATGCCGGCGAAATCACATGTG TTATCCTGATGCTGGCGAAATCATATGT
17	54	5	0.18220271770739702	ACACTGGCATAGTGATGTGTGTATGCAG CCTGATACAGGCAAAGTAATGTGTGTTT CCTGATTCTAGTGAAATCACATGTGTGT TATCCTGATGCCGGCGAAATCACATGTG TATCCTGATGCTGGCGAAATCATATGTG
18	55	5	0.1824776608681859	ACACTGGCATAGTGATGTGTGTATGCAG ATCCTGATGCTGGCGAAATCATATGTGT CAGGCAAAGTAATGTGTGTTTGCAGAGA CCTGATTCTAGTGAAATCACATGTGTGT TGCCGGCGAAATCACATGTGTGTGCAGG
19	56	5	0.1824247871834188	ACACTGGCATAGTGATGTGTGTATGCAG CAGGCAAAGTAATGTGTGTTTGCAGAGA CCTGATGCTGGCGAAATCATATGTGTGT CCTGATTCTAGTGAAATCACATGTGTGT CGGCGAAATCACATGTGTGTGCAGGGAT
20	57	4	0.2257045418495215	ACACTGGCATAGTGATGTGTGTATGCAG CCTGATTCTAGTGAAATCACATGTGTGT GGCAAAGTAATGTGTGTTTGCAGAGACA GGCGAAATCACATGTGTGTGCAGGGATA
21	58	4	0.23037064453021733	ACACTGGCATAGTGATGTGTGTATGCAG GGCAAAGTAATGTGTGTTTGCAGAGACA GGCGAAATCATATGTGTGTGCAGGGATA GTGAAATCACATGTGTGTGCAGGGATAA
22	59	4	0.23037064453021733	ACACTGGCATAGTGATGTGTGTATGCAG GGCAAAGTAATGTGTGTTTGCAGAGACA GGCGAAATCATATGTGTGTGCAGGGATA GTGAAATCACATGTGTGTGCAGGGATAA
23	60	4	0.2328557077142706	ACACTGGCATAGTGATGTGTGTATGCAG GAAATCATATGTGTGTGCAGGGATAATT GGCAAAGTAATGTGTGTTTGCAGAGACA GTGAAATCACATGTGTGTGCAGGGATAA
24	61	4	0.23308042087453074	AAATCATATGTGTGTGCAGGGATAATTG ACACTGGCATAGTGATGTGTGTATGCAG GGCAAAGTAATGTGTGTTTGCAGAGACA GTGAAATCACATGTGTGTGCAGGGATAA
25	62	4	0.23313329455929782	AATCATATGTGTGTGCAGGGATAATTGG AGTGATGTGTGTATGCAGGGACAACTGG GGCAAAGTAATGTGTGTTTGCAGAGACA GTGAAATCACATGTGTGTGCAGGGATAA
26	63	4	0.23532755247713213	ATCATATGTGTGTGCAGGGATAATTGGC GGCAAAGTAATGTGTGTTTGCAGAGACA GTGAAATCACATGTGTGTGCAGGGATAA GTGATGTGTGTATGCAGGGACAACTGGC
27	64	4	0.23223444191825726	CTGGCGAAATCATATGTGTGTGCAGGGA GTGAAATCACATGTGTGTGCAGGGATAA TAATGTGTGTTTGCAGAGACAACTGGCA TGATGTGTGTATGCAGGGACAACTGGCA
28	65	4	0.23649077354200812	GTGAAATCACATGTGTGTGCAGGGATAA TAATGTGTGTTTGCAGAGACAACTGGCA TCATATGTGTGTGCAGGGATAATTGGCA TGATGTGTGTATGCAGGGACAACTGGCA
29	66	4	0.2384074446148152	ATATGTGTGTGCAGGGATAATTGGCATG GTGAAATCACATGTGTGTGCAGGGATAA TAATGTGTGTTTGCAGAGACAACTGGCA TGATGTGTGTATGCAGGGACAACTGGCA
30	67	4	0.23842066303600695	GTGAAATCACATGTGTGTGCAGGGATAA TAATGTGTGTTTGCAGAGACAACTGGCA TATGTGTGTGCAGGGATAATTGGCATGG TGATGTGTGTATGCAGGGACAACTGGCA
