cost	target-start	target-end	target-length	left-primer-start	left-primer-num-primers	left-primer-frac-bound	left-primer-target-sequences	right-primer-start	right-primer-num-primers	right-primer-frac-bound	right-primer-target-sequences	num-guides	total-frac-bound-by-guides	guide-target-sequences	guide-target-sequence-positions
3.574934243325825	26682	26776	94	26682	1	1.0	TTTCAGACTTTTCCGACGTGCTCGAACTTT	26746	2	1.0	GTCACAACCGTGCTGGGACAGACGTACTAC GTCACAACCGTGTTGGGACAGACATACTAT	4	1.0	TGGGCATGGAATCCGGAGGTGAATGCAA TGGGCATGGAATCCTGAGGTTAATGCAA TTGGGCATGGAACCCGGAAGTGAATGCA TTGGGCATGGAATCCTGAAGTGAATGCA	{26713} {26713} {26712} {26712}
3.857243377117346	5727	5903	176	5727	2	1.0	ATAGTATGTGCTGGTGTTAAACGTGATGGT ATAGTTTGTGCTAGTGTCAAACGTGATGGT	5873	1	1.0	TTTGAGTGGTGTTGCTTACACTGCTTTTTC	3	1.0	GTGCAAGTTGGTTATTGTGCCCATGGTG TGGTGTTAAGTATTACTCACGAGTCAGG TTAAGTACTATTCACGTGTTAGAAGTGT	{5757} {5780} {5785}
3.957094263681199	26682	26854	172	26682	1	1.0	TTTCAGACTTTTCCGACGTGCTCGAACTTT	26824	2	1.0	GGCGTGCTTTACGTGGACGGACATAGATTG GGTGTTCTTTACGTGGACGGCCATAGAATC	4	1.0	TGGGCATGGAATCCGGAGGTGAATGCAA TGGGCATGGAATCCTGAGGTTAATGCAA TTGGGCATGGAACCCGGAAGTGAATGCA TTGGGCATGGAATCCTGAAGTGAATGCA	{26713} {26713} {26712} {26712}
4.019434243325826	211	305	94	211	3	1.0	CTACAAACGCCTTACTCGAGGTTCTGTCTC CTATAAACGCCCTACTCGAGGTTCTGTCTC CTATAAACGCCTTACGCGAGGTTCTGTCTC	275	1	1.0	AAACCAGTAACTGTTCCTAATGGCCTGCAA	2	1.0	GGGTTTGTGTGGAAGCAAAGTTTCGTCT GTGTTTGTGTGGAAGCAAAGTTCTGTCT	{241} {241}
4.106051599001682	26891	27014	123	26891	3	1.0	TGACAGTTGCCGTGCCGAGCACTACTATAA TGACAGTTGCCGTGCCGAGTACTACTATAA TGTCGGTTGCCGTGCCGAGCACTACTATTA	26984	1	1.0	GAGTAAAACACGGTGACTTTTCTGCAGTGA	1	1.0	TTTATAGTAGAGTCGGAAGGTCCGTAAA	{26921}
4.540109836406473	13099	13281	182	13099	3	1.0	ATGTGTTGCGCTTTGTGACGAAATGGTTCG GTGTGTTGCTCTTTGCGACGAAATGGTGCT GTGTGTTGCTTTTTGCGATGAAATGGTGCT	13251	1	1.0	CTTATATGATGCCTGTTATGGGTATGACCA	3	1.0	ACTTTGTTTTGTGTCCTCCTGGTATGGG CCTTGTTATGTGTCCGCCTGGAATGGGA TTCGTTTTGTGTCCTCCTGGAATGGGAA	{13197} {13198} {13199}
4.6000377053709505	25275	25439	164	25275	2	1.0	CAAGTGGCCGTGGTGGGTGTGGTTGTGCAT TAAGTGGCCATGGTGGGTGTGGTTGTGTAT	25409	2	1.0	GCGAATCAACTAAACTTCCTTATTACGACG GTGAGTCAACTAAACTTCCTTATTACGACG	4	1.0	TAGTTGTTTATCGTCGTCTTGTAGAGGT TGTGGTGAGTATGTTACTACTATGTTGT TGTGGTGAGTATGTTGCTACTATGTTGT TTGTGGTGAGTATGTTGCTATTATGTTG	{25377} {25323} {25323} {25322}
4.668331969052151	13039	13281	242	13039	3	1.0	TGAGGACATACACCGCGTGTACGCTGCTTT TGAGGACATACACCGTGTATACGCTGCTTT TGAGGACATACACCGTGTGTATGCTGCTTT	13251	1	1.0	CTTATATGATGCCTGTTATGGGTATGACCA	3	1.0	ACTTTGTTTTGTGTCCTCCTGGTATGGG CCTTGTTATGTGTCCGCCTGGAATGGGA TTCGTTTTGTGTCCTCCTGGAATGGGAA	{13197} {13198} {13199}
5.028743040981689	26751	26910	159	26751	2	1.0	AACCGTGCTGGGACAGACGTACTACCAACC AACCGTGTTGGGACAGACATACTATCAACC	26880	3	1.0	ACCTGAACACATGACAGTTGCCGTGCCGAG ACCTGAATACATGACAGTTGCCGTGCCGAG ACCTGAGTACATGTCGGTTGCCGTGCCGAG	2	1.0	GTGCTTTACGTGGACGGACATAGATTGG GTTGAGCGGTGTTCTTTACGTGGACGGC	{26827} {26817}
5.033273809953941	13150	13281	131	13150	4	1.0	AACTCTAGACAACCAGGATCTTAATGGGAA GACCCTCGATAATCAGGATCTCAATGGGAA GACCTTAGACAACCAAGATCTTAATGGGAA GACCTTAGATAACCAAGACCTTAATGGGAA	13251	1	1.0	CTTATATGATGCCTGTTATGGGTATGACCA	3	1.0	ACTTTGTTTTGTGTCCTCCTGGTATGGG CCTTGTTATGTGTCCGCCTGGAATGGGA TTCGTTTTGTGTCCTCCTGGAATGGGAA	{13197} {13198} {13199}
5.355082728833828	25242	25439	197	25242	3	1.0	CCTTGAGTGGCTCAACCGTGTAGAAAACTA CTTAAAGTGGCTCAACCGGGTTGAGACTTA TCTTGAGTGGCTCAACCGTGTTGAGACTTA	25409	2	1.0	GCGAATCAACTAAACTTCCTTATTACGACG GTGAGTCAACTAAACTTCCTTATTACGACG	4	1.0	TAGTTGTTTATCGTCGTCTTGTAGAGGT TGTGGTGAGTATGTTACTACTATGTTGT TGTGGTGAGTATGTTGCTACTATGTTGT TTGTGGTGAGTATGTTGCTATTATGTTG	{25377} {25323} {25323} {25322}
5.431722044777587	9565	9799	234	9565	4	1.0	CTGGCGAAGGTTTTAACATCTTAGCTTGTT CTGGTGAAGGATTTAACATTCTGGCGTGTT CTGGTGAAGGTTTTAACATCCTAGCTTGCT CTGGTGAAGGTTTTAACATCTTAGCATGCT	9769	1	1.0	GCTTTGATGGTGTTATGTATGGTGGTTTTG	4	1.0	ATCTTAGAGGTAGCGAGGTTGAGTTTTG TGGTTGTGCTCAAGGTGTCTTTGGTGTA TGGTTGTGCTCAAGGTGTTTTTGGTGTG TTTCGGTGTGAACATGAGGACCAATTGG	{9694} {9599} {9599} {9617}
5.501591578646307	11925	12138	213	11925	2	1.0	GGACGTGCATTTATGTATGCATATGTGACT GGCCGTGCATTTATGTATGCGTATGTGACC	12108	3	1.0	GGTGCTGTTTTGGGTTACATAGGCGCTACT GGTGCTGTTTTGGGTTACATTGGTGCCACT GGTGCTGTTTTGGGTTATATCGGTGCTACT	5	1.0	GTTAAATGGGAACATGAATCGGGCGTGG GTTAAATGGGACCATGACTCCGGTGTGG TTAAATGGGAACATGACTCTGGCGTGGT TTAAATGGGAACATGAGTCTGGTGTTGT TTAAATGGGAGCATGACTCTGGTGTGGT	{11976} {11976} {11977} {11977} {11977}
5.555599999999999	211	335	124	211	3	1.0	CTACAAACGCCTTACTCGAGGTTCTGTCTC CTATAAACGCCCTACTCGAGGTTCTGTCTC CTATAAACGCCTTACGCGAGGTTCTGTCTC	305	3	1.0	CCGTGTGACACTTGCCGTAGCAAGTGATAC CCGTGTGACACTTGCTGTTGCAAGTGATAC CCGTTTTACACTTGCCGTTGCAAGTGATTC	2	1.0	GGGTTTGTGTGGAAGCAAAGTTTCGTCT GTGTTTGTGTGGAAGCAAAGTTCTGTCT	{241} {241}
5.569330266661923	11925	12174	249	11925	2	1.0	GGACGTGCATTTATGTATGCATATGTGACT GGCCGTGCATTTATGTATGCGTATGTGACC	12144	3	1.0	CTGCAGGCTGGTAAACAAACTGAGTTTGTT TTGCAAGCTGGCAAACAGACTGAGTTCGTT TTGCAAGCTGGTAAACAGACTGAGTTTGTT	5	1.0	GTTAAATGGGAACATGAATCGGGCGTGG GTTAAATGGGACCATGACTCCGGTGTGG TTAAATGGGAACATGACTCTGGCGTGGT TTAAATGGGAACATGAGTCTGGTGTTGT TTAAATGGGAGCATGACTCTGGTGTGGT	{11976} {11976} {11977} {11977} {11977}
5.738232422683972	26634	26854	220	26634	4	1.0	TATGGCCATAGCCACACTTGTTATGTGGGT TATGGCCGTATCAACACTCATTATGTGGGT TATGGCCGTATCAACACTCGTTATATGGGT TATGGCTATAGCCACATTTGTTATGTGGGT	26824	2	1.0	GGCGTGCTTTACGTGGACGGACATAGATTG GGTGTTCTTTACGTGGACGGCCATAGAATC	1	1.0	GACGTGCTCGAACTTTTTGGGCATGGAA	{26696}
5.849332422683972	211	431	220	211	3	1.0	CTACAAACGCCTTACTCGAGGTTCTGTCTC CTATAAACGCCCTACTCGAGGTTCTGTCTC CTATAAACGCCTTACGCGAGGTTCTGTCTC	401	3	1.0	CAATGGATTTAGAGCATGCCGATTTGTTTC CAATGGTTTTAGAACATGCCGATTTGTCTC CAATGGTTTTAGGGCATGCCGATTTGTTTC	2	1.0	GGGTTTGTGTGGAAGCAAAGTTTCGTCT GTGTTTGTGTGGAAGCAAAGTTCTGTCT	{241} {241}
5.851329730317068	8484	8705	221	8484	2	1.0	GACAAGTGGTTTGTTAATGATGGAAGTGTG GACAAGTGGTTTGTTAATGATGGACGTGTT	8675	4	1.0	TAGACGCATGTTTGGCGATCTTTCTGTAGG TAGACGCATGTTTGGTGACCTTTCTGTAGG TAGACGCATGTTTGGTGATTTGTCTGTAGG TAGACGTATGTTTGGTGATCTTTCTGTGGG	2	1.0	GGTTATGTTTGCGGTACAGGTCTGTGGG GTTATGTTTGTGGTACTGGTTTGTGGAA	{8520} {8521}
5.976628507007025	8526	8705	179	8526	2	1.0	GTTTGCGGTACAGGTCTGTGGGATCTTGTG GTTTGTGGTACTGGTTTGTGGAACCTTGTA	8675	4	1.0	TAGACGCATGTTTGGCGATCTTTCTGTAGG TAGACGCATGTTTGGTGACCTTTCTGTAGG TAGACGCATGTTTGGTGATTTGTCTGTAGG TAGACGTATGTTTGGTGATCTTTCTGTGGG	4	1.0	CGTAGGTGCCTTTGTTATACTTTGTTGT GTGCATTAGGTGCTTTTGTCATCTTTTG TGCATTAGGTGCTTTTGCCATCTTTTGT TTCGCAATCTTTTGTTGTTTTCTCGTGA	{8630} {8626} {8627} {8640}
5.987322044777587	11657	11804	147	11657	3	1.0	AATGATGGTAGATGGTTTTGTGCACTACGC AATGATGGTAGATGGTTTTGTTCACTACGC AATGTTGGTAGATGGTTTTGTGCACTATGC	11774	3	1.0	ACTTGTCTGGCCTCTGATTTTGACATGCGA ACTTGTTTGGCCTCTGATTTTGACTTGTGA ACTTGTTTGGCCTTTGGTTTTGACATGTGA	5	1.0	AGGCGTTGTTTGGACTTTACAAGAAGTT ATGGTAGGAATGTGCATCTTAAGGATGT GGGTGTAGTTTGGACACTACAAGAAGTT GTTGTTTGGACAGTACAAGAAGTTAAGG TGGCGTTGTTTGGACATTACAAGAAGTT	{11687} {11725} {11687} {11691} {11687}
6.050843513028184	25275	25485	210	25275	2	1.0	CAAGTGGCCGTGGTGGGTGTGGTTGTGCAT TAAGTGGCCATGGTGGGTGTGGTTGTGTAT	25455	4	1.0	ACAGTAATGGCTCTAGGTTTGTTCACATTG ACAGTAATGGCTCTAGGTTTGTTTACTCTG ACAGTAATGGCTTTAGGCTTGTTCACATTG TCAGTAATGGCTCTAGGCTTGTTCACACTT	4	1.0	TAGTTGTTTATCGTCGTCTTGTAGAGGT TGTGGTGAGTATGTTACTACTATGTTGT TGTGGTGAGTATGTTGCTACTATGTTGT TTGTGGTGAGTATGTTGCTATTATGTTG	{25377} {25323} {25323} {25322}
6.114588504066714	11657	11900	243	11657	3	1.0	AATGATGGTAGATGGTTTTGTGCACTACGC AATGATGGTAGATGGTTTTGTTCACTACGC AATGTTGGTAGATGGTTTTGTGCACTATGC	11870	3	1.0	TGAAAGCGATGGAGGTCTTAGCAGTGAAGG TGAAGGTGATGGAGGCATTACTAGTGAAGG TGAGGGTGATGGAGGTGTTACTAGTGAAGG	4	1.0	AGGTGTTGTTTGGACTTTACAAGAAGTT GAAACACTTGTTTGGCCTTTGGTTTTGA GGGTGTAGTTTGGACACTACAAGAAGTT TGGCGTTGTTTGGACATTACAAGAAGTT	{11687} {11769} {11687} {11687}
6.1704799693424075	26638	26775	137	26638	5	1.0	GCCATAGCCACACTTATTATGTGGGTTATG GCCGTATCAACACTCATTATGTGGGTGATG GCCGTATCAACACTCGTTATATGGGTGATG GCCGTATCAACACTCGTTATGTGGGTTATG GCTATAGCCACATTTGTTATGTGGGTTATG	26745	2	1.0	AGTCACAACCGTGCTGGGACAGACGTACTA TGTCACAACCGTGTTGGGACAGACATACTA	1	1.0	GACGTGCTCGAACTTTTTGGGCATGGAA	{26696}
6.217251599001681	26787	26910	123	26787	4	1.0	ACAAGCCCCCACAGGGATCACAGTAACCCT ACAAGCGCCTACAGGGATCACAGTAACCCT ACAAGCTCCAACAGGCATTACGGTGACCTT ACAAGCTCCTACAGGCATCACGGTGACCTT	26880	3	1.0	ACCTGAACACATGACAGTTGCCGTGCCGAG ACCTGAATACATGACAGTTGCCGTGCCGAG ACCTGAGTACATGTCGGTTGCCGTGCCGAG	2	1.0	GTGCTTTACGTGGACGGACATAGATTGG GTTGAGCGGTGTTCTTTACGTGGACGGC	{26827} {26817}
6.2223	8484	8608	124	8484	2	1.0	GACAAGTGGTTTGTTAATGATGGAAGTGTG GACAAGTGGTTTGTTAATGATGGACGTGTT	8578	5	1.0	CATCCTCATTTTCTGTTGCCGCAATGTCAG CATCTTCATTTTCTGTTGCTGCAATGTCAG CATGTTCATTTTCTGTAGCTGCAATGTCAG CATTATCGTTCTCTGTAGCCGCAATGTCAG CGTCCTCATTCTCTATTGCTGCAATGTCAG	2	1.0	GGTTATGTTTGCGGTACAGGTCTGTGGG GTTATGTTTGTGGTACTGGTTTGTGGAA	{8520} {8521}
6.2344296428427715	11873	12027	154	11873	3	1.0	AAGCGATGGAGGTCTTAGCAGTGAAGGCAA AGGTGATGGAGGCATTACTAGTGAAGGTAA GGGTGATGGAGGTGTTACTAGTGAAGGTAA	11997	4	1.0	GGCGTGGTTACAGTAGAACTAGAACCACCT GGTGTGGTTACAGTTGAATTGGAACCACCT GGTGTGGTTGCAGTGGAATTGGAACCACCT GGTGTTGTTACAGTAGAGTTAGAACCTCCA	1	1.0	GGACGTGCATTTATGTATGCATATGTGA	{11925}
6.312711090344213	5727	5847	120	5727	2	1.0	ATAGTATGTGCTGGTGTTAAACGTGATGGT ATAGTTTGTGCTAGTGTCAAACGTGATGGT	5817	5	1.0	GGGCGTGCCATCATAGTTAGTGTAGAGCGT GGTAGAGCCATCATAGTAGGTGTTGAACAA GGTAGAGCTATTATAGTCAGTGTTGAACAG GGTAGAGCTATTATATTCAGTGTCGAACAG GGTAGGGCTATTATAGTTAGTGTTGAACAG	3	1.0	GTGCAAGTTGGTTATTGTGCCCATGGTG TGGTGTTAAGTATTACTCACGAGTCAGG TTAAGTACTATTCACGTGTTAGAAGTGT	{5757} {5780} {5785}
6.407368161147406	1208	1382	174	1208	3	1.0	GTTCGTAGCTAGCATTGAGGGCGTTTCTGT GTTTGTTGCAAACATTGAAGGTGTCTCTGT GTTTGTTGCAAGCATTGAATGTGTCGCTGT	1352	4	1.0	AACTGATGAGTGTCGATTGGCCATGTTAGG TACTGATGAGTGTCGTATAGCTATGTTAGG TACTGATGAGTGTCGTTTGGCCATGTTGGG TGTTGATGAGTGTCGTATGGCCATGTTGGG	2	1.0	GAATGGATACATTCTGCTTCAATGTACG TGGAGAGTGATTGCTCTTCAGAGTGTTG	{1315} {1239}
6.4336591090491435	26891	27126	235	26891	3	1.0	TGACAGTTGCCGTGCCGAGCACTACTATAA TGACAGTTGCCGTGCCGAGTACTACTATAA TGTCGGTTGCCGTGCCGAGCACTACTATTA	27096	4	1.0	TGGGCTGATGAGTCTGAGCAGCAGCGTGGT TGGGCTGATGCATCTGAACCACAACGTGGT TGGGCTGATGCTTCTGAACCACGGCGTGGT TGGGCTGATTCCTCTGAACCACAACGTGGT	1	1.0	TTTATAGTAGAGTCGGAAGGTCCGTAAA	{26921}
6.454364373321448	1319	1445	126	1319	4	1.0	GGACACATTCTGTTTCAATGTACGCAATAG GGATACACTCTGCTTCAATGTGCGTAATGC GGATACATTCTGCTTCAATGTACGCAATAG GGATACATTCTGCTTCAATGTGCGTAATAG	1415	3	1.0	TGCTACAGGTGTTATTGATATTAGTGCAGG TGCTGCAGGTGTCATAGACATTAGTACCGG TGCTGCAGGTGTCATTGACATTAGCACCGG	4	1.0	CTGATGAGTGCCGATTGGCCATGTTAGG CTGATGAGTGTCGTATGGCTATGTTAGG CTGATGAGTGTCGTTTAGCTATGTTAGG GATGAGTGTCGTTTGGCCATGTTGGGTG	{1354} {1354} {1354} {1356}
6.460021916171137	11777	12027	250	11777	3	1.0	TGTCTGGCCTCTGATTTTGACCTGCGAACG TGTTTGGCCTCTGATTTTGACTTGTGAACG TGTTTGGCCTTTGGTTTTGACATGTGAACG	11997	4	1.0	GGCGTGGTTACAGTAGAACTAGAACCACCT GGTGTGGTTACAGTTGAATTGGAACCACCT GGTGTGGTTGCAGTGGAATTGGAACCACCT GGTGTTGTTACAGTAGAGTTAGAACCTCCA	1	1.0	GGACGTGCATTTATGTATGCATATGTGA	{11925}
6.518468161147406	25275	25392	117	25275	2	1.0	CAAGTGGCCGTGGTGGGTGTGGTTGTGCAT TAAGTGGCCATGGTGGGTGTGGTTGTGTAT	25362	5	1.0	TTGCTGCGGCTTCTTTAGTTGTTTTGCATC TTGCTGTGGCTTCTTTAGTTGTCTTGCATC TTGCTGTGGTTTCTTTAGTTGTCTTGCATC TTGTTGCGGCTTCTTTAGTTGTCTTGCATC TTGTTGTGGCTGCTGTAGTTGTTTATCGTC	5	1.0	GATTGTGTTGATTTTTGTGGTGGGCTTG TGGGCTTGCTCTTACTGTGCTGCTGTGC TGTGGTGAGTATGTTACTACTATGTTGT TGTGGTGAGTATGTTGCTACTATGTTGT TTGTGGTGAGTATGTTGCTATTATGTTG	{25308} {25328} {25323} {25323} {25322}
6.521987395870146	6466	6689	223	6466	4	1.0	GCGGTAATTCATTGGGCTGTAAGATGTGTC GTGAAGGTTCACTAGGTTGTAAAATGTGTC GTGATGGTTCATTGGGCTGCAAGATGTGTC GTGATGGTTCATTGGGCTGTAAAATGTGTC	6659	3	1.0	GATGATAAGCAATGTAGGCGTTTTCTTGGG GATGATAAGCACAGTTGGTGTTTTTCTAGG GATGATAAGCACTGTTGGTGTTTTTCTGGG	2	1.0	CAGTTTCATCATTTAGCTGTTGTGTGGA GACAATTATCTGAGATGCTTCTTGCTGT	{6519} {6618}
6.52589679600542	1157	1382	225	1157	3	1.0	AACGCAGAAAGCAGGCGTTGGTATTAAGTA AACTCAGCAAGCTGGTGCTGGTATTAAGTA TACTCAGCAAGCTGGTGTTGGTGTTAAGTA	1352	4	1.0	AACTGATGAGTGTCGATTGGCCATGTTAGG TACTGATGAGTGTCGTATAGCTATGTTAGG TACTGATGAGTGTCGTTTGGCCATGTTGGG TGTTGATGAGTGTCGTATGGCCATGTTGGG	2	1.0	GAATGGATACATTCTGCTTCAATGTACG GTGTCTCTGTTTGGAGAGTGATTGCTCT	{1315} {1228}
6.5556	11925	12049	124	11925	2	1.0	GGACGTGCATTTATGTATGCATATGTGACT GGCCGTGCATTTATGTATGCGTATGTGACC	12019	5	1.0	AACCACCTTGCAAATTCGTTGTAGATACAC AACCACCTTGCAGATTTGTTGTAGACACAC AACCACCTTGCAGATTTGTTGTAGATACAC AACCACCTTGCAGGTTTGTAGTAGATACAC AACCTCCATGTAGGTTTGTAGTCGATACAC	5	1.0	GTTAAATGGGAACATGAATCGGGCGTGG GTTAAATGGGACCATGACTCCGGTGTGG TTAAATGGGAACATGACTCTGGCGTGGT TTAAATGGGAACATGAGTCTGGTGTTGT TTAAATGGGAGCATGACTCTGGTGTGGT	{11976} {11976} {11977} {11977} {11977}
6.579714134296109	6659	6857	198	6659	3	1.0	GATGATAAGCAATGTAGGCGTTTTCTTGGG GATGATAAGCACAGTTGGTGTTTTTCTAGG GATGATAAGCACTGTTGGTGTTTTTCTGGG	6827	4	1.0	TGCATGTTCTAAGAGTGCTAGACTTAAGAG TGCGTGCTCTAAGAGTGCTAGACTTAAGAG TGCTTGCTCAAAGAGTGCAAGATTGAAGCG TGCTTGTTCTAAAAGTGCAAGACTTAAGCG	3	1.0	ATGTGCTTTTTGGTTGTGAAAACACAGA TCTCTTTTGTAAGACATGTGCTATTTGG TGTGATGAATTGTTGGTCACTATCATTG	{6793} {6778} {6738}
6.610689493487166	8860	9072	212	8860	5	1.0	ACATATCTTTTGCCCCATGGTGGCTGTGTG ACATTTCCTTTGCTCCATGGTGGCTGTGTG ACATTTCTTTTGCACCATGGTGGTTGTGTA ATATTTCTTTTGCTCCATGGTGGTTGTGTG ATGTTTCATTCGCACCGTGGTGGCTGTGCG	9042	2	1.0	CTTGCTAACAGCATTTCGCCAGATAAGTTG CTTGCTAATAGCATCTCTCCAGAAAAGTTG	3	1.0	CTGGTACTTTTTATCTATGCTTACGGGT CTTGGTACTTTTTGGCAATGTTAACAGG TTGGTACTTTCTTGCTATGTTAACAGGT	{8891} {8890} {8891}
6.661307968360734	11566	11804	238	11566	4	1.0	CACGTAATGGTGTTGTACCCCTCTCTGTTA CACGTAATGGTGTTGTCCCTCTCTCTGTTA CACGTAATGGTGTTGTCCCTCTTTCCGTTA CACGTAATGGTGTTGTTCCTCTTTCTGTTA	11774	3	1.0	ACTTGTCTGGCCTCTGATTTTGACATGCGA ACTTGTTTGGCCTCTGATTTTGACTTGTGA ACTTGTTTGGCCTTTGGTTTTGACATGTGA	3	1.0	AAATGATGGTAGATGGTTTTGTGCACTA GCAGGTGTTGTTTGGACTTTACAAGAAG TTTGCGAGAATGATGGTAGATGGTTTTG	{11656} {11685} {11649}
6.781288504066715	25242	25485	243	25242	3	1.0	CCTTGAGTGGCTCAACCGTGTAGAAAACTA CTTAAAGTGGCTCAACCGGGTTGAGACTTA TCTTGAGTGGCTCAACCGTGTTGAGACTTA	25455	4	1.0	ACAGTAATGGCTCTAGGTTTGTTCACATTG ACAGTAATGGCTCTAGGTTTGTTTACTCTG ACAGTAATGGCTTTAGGCTTGTTCACATTG TCAGTAATGGCTCTAGGCTTGTTCACACTT	4	1.0	TAGTTGTTTATCGTCGTCTTGTAGAGGT TGTGGTGAGTATGTTACTACTATGTTGT TGTGGTGAGTATGTTGCTACTATGTTGT TTGTGGTGAGTATGTTGCTATTATGTTG	{25377} {25323} {25323} {25322}
6.901129642842771	26891	27045	154	26891	3	1.0	TGACAGTTGCCGTGCCGAGCACTACTATAA TGACAGTTGCCGTGCCGAGTACTACTATAA TGTCGGTTGCCGTGCCGAGCACTACTATTA	27015	5	1.0	CTCACCTACGAGCAACATGACAGAAAATGA CTCCCCCATGAGCAACATGACAGAAAACGA CTCTCCACAGAGCAATATGACAGAAAATGA CTCTCCTACGAGCAATATGACAGAAAACGA CTCTCCTATGAGCAACATGACAGAAAACGA	1	1.0	TTTATAGTAGAGTCGGAAGGTCCGTAAA	{26921}
7.0507439250039425	1279	1445	166	1279	5	1.0	CTTCTGCCACTTTTGTGGAAGAAGAACATG CTTCTGCTACCTTTGTAGAAGAGGAACATG CTTCTGCTACTTTTGTAGAGGAGGAACATG CTTCTGCTGATTATGTAGAGGAGGACCACC CTTCTTCCACTTTTGTAGAAGAGGAACATG	1415	3	1.0	TGCTACAGGTGTTATTGATATTAGTGCAGG TGCTGCAGGTGTCATAGACATTAGTACCGG TGCTGCAGGTGTCATTGACATTAGCACCGG	2	1.0	GAATGGACACATTCTGTTTCAATGTACG GAATGGATACATTCTGCTTCAATGTACG	{1315} {1315}
7.091066666009797	8860	9005	145	8860	5	1.0	ACATATCTTTTGCCCCATGGTGGCTGTGTG ACATTTCCTTTGCTCCATGGTGGCTGTGTG ACATTTCTTTTGCACCATGGTGGTTGTGTA ATATTTCTTTTGCTCCATGGTGGTTGTGTG ATGTTTCATTCGCACCGTGGTGGCTGTGCG	8975	3	1.0	ATTTGTAGGTACATTTGAAAGTGCTGCTGC GTTCGTAGGCACATTTGAAAGTGCTGCTGC GTTTGTGGGTACATTCGAAAGTGCTGCAGC	3	1.0	CTGGTACTTTTTATCTATGCTTACGGGT CTTGGTACTTTTTGGCAATGTTAACAGG TTGGTACTTTCTTGCTATGTTAACAGGT	{8891} {8890} {8891}
7.125885018119717	27099	27293	194	27099	4	1.0	GCTGATGAGTCTGAGCAGCAGCGTGGTCGT GCTGATGCATCTGAACCACAACGTGGTCGT GCTGATGCTTCTGAACCACGGCGTGGTCGT GCTGATTCCTCTGAACCACAACGTGGTCGT	27263	4	1.0	AAAACGCTTCAGAACTAAGAAAGGTCAGAG AAAACGCTTCAGAACTCGTAAAGGGCAGCG AAAACGTTTCAGAACTAGAAAGGGCAAACG GAAAAGATTCCGCACTAGGAAGGGCAAGAA	2	1.0	TGGAAAGTGATACCTCGTGACTTGGTAC TTGGAAGGTGATACCTCGTAATTTGGTA	{27186} {27185}
7.2040468288076465	26953	27184	231	26953	3	1.0	CAAAATAGCACAGGCTGGGTTTTCTACGTA CGAAACAGCACAGGCTGGGTTTTCTACGTA CGTAACAACACAGGTTGGATGTTTTATGTC	27154	5	1.0	ACAGACCTTTGCTTGTCGACAATGACCAGC ATAACCCCTTGCTTGTCGAAAATGGCCAAC ATAGCCCTTTGCTTGTTGACAATGATCAAC ATAGCCCTTTGCTTGTTGATAGTGAACAAC ATAGTCCTTTGCTTGTTGACAGTGAACAAC	2	1.0	ACGTGGTCGTCAGGGTAGAATACCTTAC CGAGTAAAGCACGGTGACTTTTCTGCAG	{27119} {26983}
7.2096220447775865	18937	19171	234	18937	4	1.0	GGATTATGAAGCAGAACGTCCTCTAACTAG GGATTATGAAGCTGAACGTCCTTTGACTAG GGATTATGAAGCTGACCGGCCCTTGACAAG GGATTATGAAGCTGAGCGTCCCTTTACAAG	19141	4	1.0	TGGAATGCTTAACGGTAATGCAATTGCTAC TGGAATGCTTAATGGTAATGCCATTGCTAC TGGAATGCTTAATGGTAATGCCGTCGCTAC TGGTATGCTTAATGGTAATCCTGTAGCAAC	2	1.0	GGTGGTAAAAATTTGCCAGCCATTCGGT GGTGGTAAAAGTTTGCCGGCTATTAAAT	{19106} {19106}
7.213285705661208	8372	8608	236	8372	3	1.0	GCCAGAAGTTATTGCACAAGGCTTTGGGTT GCCAGAAGTTATTGCACAGGGTTTTGGTTT GCCGGAAATAATTGCACAGGGCTTTGGTTT	8578	5	1.0	CATCCTCATTTTCTGTTGCCGCAATGTCAG CATCTTCATTTTCTGTTGCTGCAATGTCAG CATGTTCATTTTCTGTAGCTGCAATGTCAG CATTATCGTTCTCTGTAGCCGCAATGTCAG CGTCCTCATTCTCTATTGCTGCAATGTCAG	2	1.0	GGTTATGTTTGCGGTACAGGTCTGTGGG GTTATGTTTGTGGTACTGGTTTGTGGAA	{8520} {8521}
7.214697268051916	8820	9005	185	8820	5	1.0	CATTATGCATGGATTTGGTGTGCAGCTTAT CGCTACGCATGGATTTGGTGTGCTGCATAT CGCTATGCATGGATCTGGTGTGCAGCTTAT CGCTATGCATGGATTTGGTGTGCTGCATAC CGTTATGCATGGATTTGGTGTGCTGCATAT	8975	3	1.0	ATTTGTAGGTACATTTGAAAGTGCTGCTGC GTTCGTAGGCACATTTGAAAGTGCTGCTGC GTTTGTGGGTACATTCGAAAGTGCTGCAGC	3	1.0	GTTTCATTCGCACCGTGGTGGCTGTGCG TGGTGGCTGTGTGCTTGGTACTTTCTTG TGGTGGTTGTGTACTTGGTACTTTTTGG	{8862} {8877} {8877}
7.224794696155047	11615	11804	189	11615	5	1.0	CAAACTCGTCGTTGTAGTACCAGATCATGA CAAGCTCGTCGTCGTGGTGCCAGATCATGA CAAGCTTGTTGTTGTAGTACCAGATCATGA CAAGCTTGTTGTTGTAGTGCCAGATTATGA CAGGCTCGTCGTCGTAGTGCCAGATCATGA	11774	3	1.0	ACTTGTCTGGCCTCTGATTTTGACATGCGA ACTTGTTTGGCCTCTGATTTTGACTTGTGA ACTTGTTTGGCCTTTGGTTTTGACATGTGA	3	1.0	AAATGATGGTAGATGGTTTTGTGCACTA GCAGGTGTTGTTTGGACTTTACAAGAAG TTTGCGAGAATGATGGTAGATGGTTTTG	{11656} {11685} {11649}
7.237821916171137	211	461	250	211	3	1.0	CTACAAACGCCTTACTCGAGGTTCTGTCTC CTATAAACGCCCTACTCGAGGTTCTGTCTC CTATAAACGCCTTACGCGAGGTTCTGTCTC	431	5	1.0	ATTAGATTTGCAGGATTGCATCGTTGGCAT ATTTGGCTTGCACGATTGTGTTGTTGGCAT ATTTGGCTTGCATGATTGCGTTGTTGGCAT ATTTGGTTTGCAAGATTGCGTCGTTGGTGT ATTTGGTTTGCAAGATTGCGTTGTTGGCAT	2	1.0	GGGTTTGTGTGGAAGCAAAGTTTCGTCT GTGTTTGTGTGGAAGCAAAGTTCTGTCT	{241} {241}
7.312711090344212	492	672	180	492	4	1.0	GGCAATCAGACGTTGTTTTGCAACATAATG GGCGACCAACCACTGGTTTGCAACTTGATG GGTAACCAAACGTTGTCCTGCAATATAATG GGTAACCAAACGTTGTTCTGCAACATAATG	642	4	1.0	GACCAATACCTCTGCGGAGCCGATGGCAAA GACCAATACCTTTGCGGTGCCGATGGAAAA GACCAGTATCTCTGTGGCGCCGATGGCAAA GATCAATACCTATGCGGTGCCGATGGCAAA	4	1.0	CCCTTTATGCTTAGAGGGTGGTTGGTGT GACCGGCCTTTTGGTTTACGAGGTTGGT TCCCTTTATGCTTCGTGGTTGGTTGGTT TGACCGTCCTTTTATGCTTCATGGGTGG	{537} {531} {536} {530}
7.331589758004454	25242	25392	150	25242	3	1.0	CCTTGAGTGGCTCAACCGTGTAGAAAACTA CTTAAAGTGGCTCAACCGGGTTGAGACTTA TCTTGAGTGGCTCAACCGTGTTGAGACTTA	25362	5	1.0	TTGCTGCGGCTTCTTTAGTTGTTTTGCATC TTGCTGTGGCTTCTTTAGTTGTCTTGCATC TTGCTGTGGTTTCTTTAGTTGTCTTGCATC TTGTTGCGGCTTCTTTAGTTGTCTTGCATC TTGTTGTGGCTGCTGTAGTTGTTTATCGTC	5	1.0	GATTGTGTTGATTTTTGTGGTGGGCTTG TGGGCTTGCTCTTACTGTGCTGCTGTGC TGTGGTGAGTATGTTACTACTATGTTGT TGTGGTGAGTATGTTGCTACTATGTTGT TTGTGGTGAGTATGTTGCTATTATGTTG	{25308} {25328} {25323} {25323} {25322}
7.333365756109888	5584	5825	241	5584	4	1.0	GTGACAAGGGTGATGCTGAAGACACTTTGA GTGCCAAAGGTGATGCTGAAGACACTTTGA GTGCTAAGGGTGATGCTGAAGATATTTTGA GTTCTAAGGGTGATGCTGAAGACACTTTGA	5795	4	1.0	CTCACGAGTCAGGAGTGTTAGTGGGCGTGC TTCACGTGTTAAAAGTGTTAGAGGTAGAGC TTCACGTGTTAAGAGTGTCAGTGGTAGAGC TTCACGTGTTAGAAGTGTTAGCGGTAGAGC	3	1.0	GGCTCAGGTTCAACTAGAGAATTATAGC GTGATGGTGTGCAAGTTGGTTATTGTGC GTTCTTGTGTTGAATGTGAGGCTACATT	{5642} {5749} {5668}
7.355182728833828	1315	1512	197	1315	3	1.0	GAATGGACACATTCTGTTTCAATGTACGCA GAATGGATACATTCTGCTTCAATGTACGCA GAATGGATACATTCTGCTTCAATGTGCGTA	1482	5	1.0	AAACCATGGTTCGTTCGCAAAGCCGAAGAC AAACCATGGTTTGTGCGTAAGGCAGAGGAC AAACCATGGTTTGTTCGCAAGGCTGAAGAC AAACCCTGGTTTGTGCGCAAGGCTGAAGAT AAACCGTGGTTTGTTCGCAAGGCTGAAGAT	4	1.0	CTGATGAGTGCCGATTGGCCATGTTAGG CTGATGAGTGTCGTATGGCTATGTTAGG CTGATGAGTGTCGTTTAGCTATGTTAGG GATGAGTGTCGTTTGGCCATGTTGGGTG	{1354} {1354} {1354} {1356}
7.373375799801318	11657	11862	205	11657	3	1.0	AATGATGGTAGATGGTTTTGTGCACTACGC AATGATGGTAGATGGTTTTGTTCACTACGC AATGTTGGTAGATGGTTTTGTGCACTATGC	11832	5	1.0	ATAATGCCAGGCAAGATGAAGGTCAAGGCC ATAATGCCAGGTAAAATGAAGGTCAAAGCC ATAATGCCAGGTAAAATGAAGGTTAAGGCC ATAATGCCAGGTAAGATGAAAGTCAAAGCC ATAATGCCGGGCAAGATGAAGGTTAAAGCC	4	1.0	AGGTGTTGTTTGGACTTTACAAGAAGTT GAAACACTTGTTTGGCCTTTGGTTTTGA GGGTGTAGTTTGGACACTACAAGAAGTT TGGCGTTGTTTGGACATTACAAGAAGTT	{11687} {11769} {11687} {11687}
7.404932422683972	650	870	220	650	4	1.0	CCTCTGCGGAGCCGATGGCAAACCTGTCAT CCTTTGCGGTGCCGATGGCAAACCTGTCAT CCTTTGCGGTGCTGATGGAAAACCTGTCAT TCTCTGTGGCGCCGATGGCAAACCTGTCAT	840	4	1.0	GATGCTTTGCATACACTACGCAATGGTTCT GATGCTTTGCATACACTACGTAACGGTTCT GATGCTTTGCATACACTGCGTAATGGTTCT GATGCTTTGCATACGTTGCGCAATGGTTCT	4	1.0	AATGAAGATTTGTGGCAATTTGTCGACC CAATGGCCAGACGTATGTTTGTGCGTGG GTGATGATTTATGGCAGTTTGTTGACCA TTGGCTATAGAGGAAATAGAATACGTGC	{681} {737} {682} {807}
7.422475410741901	4998	5227	229	4998	5	1.0	CAACGATGCACACGTAAGTTGAATAGACTT CAACGGTGCACGCGTAAGCTGAATAGACTT CAACGGTGTACACGTAAGCTGAATAGACTT CAGAGGTGTACACGTAAGTTAAATAGGCTT CAGCGATGTACACGTAAGTTGAATAGACTT	5197	3	1.0	CAGACAAGTCATTTGAACAACAAGTTGGTG CGGACAAACCATTTGAGCAGCAGGTTGGCG CGGATAAGTCGTTTGAGCAACAAGTTGGTG	4	1.0	ACCTGTAATGTTGCATTTGTGGGTGAGC AGCTGAACATATCTTGCCCTTGGTTTTG GCCGTTAATATTGTCCGGTTTGACTTGT GTTTGACTTGTAATGTTTCTTTTGTAGG	{5091} {5054} {5069} {5086}
7.424366666009797	854	1084	230	854	5	1.0	ACTACGAAATGGTTCTGTTCTTGAAACGGC ACTACGCAATGGTTCTGTTCTTGAAATGGC ACTACGTAACGGTTCTGTTCTTGAAACGGC ACTGCGTAATGGTTCTGTTCTTGATATAGC GTTGCGCAATGGTTCTGTTCTTGAAACGGC	1054	3	1.0	CTGTCGGTGATTGGACTGGTTTTAAATCCA CTGTGGGTGATTGGACCGGTTTTAAATCCT CTGTTGGTGATTGGACCGGATTTAAATCCT	4	1.0	AAGGAAGTGAAGACATCCAGTAAAGTTG GAGGCCAAAATATCCAGTAAGGTGGTGT GGAAGTGAAGACATCTAGTAAGGTTGTG GTAAAGTGGTGTTAAGTGCTGAGCTTGA	{885} {888} {887} {904}
7.428216028494806	1279	1382	103	1279	5	1.0	CTTCTGCCACTTTTGTGGAAGAAGAACATG CTTCTGCTACCTTTGTAGAAGAGGAACATG CTTCTGCTACTTTTGTAGAGGAGGAACATG CTTCTGCTGATTATGTAGAGGAGGACCACC CTTCTTCCACTTTTGTAGAAGAGGAACATG	1352	4	1.0	AACTGATGAGTGTCGATTGGCCATGTTAGG TACTGATGAGTGTCGTATAGCTATGTTAGG TACTGATGAGTGTCGTTTGGCCATGTTGGG TGTTGATGAGTGTCGTATGGCCATGTTGGG	2	1.0	GAATGGACACATTCTGTTTCAATGTACG GAATGGATACATTCTGCTTCAATGTACG	{1315} {1315}
7.440903865708117	1315	1554	239	1315	3	1.0	GAATGGACACATTCTGTTTCAATGTACGCA GAATGGATACATTCTGCTTCAATGTACGCA GAATGGATACATTCTGCTTCAATGTGCGTA	1524	5	1.0	TGCTGGTCCGCTCTTGTTTCCGTACTCAAA TGCTGGTCTGCACTAGTTTCAGTTCTCAAA TGTTGGTCCGCTCTTGTTTCTGCACTTAAA TGTTGGTCCTCTCTTGTTTCTGTACTCAAA TGTTGGTCTGCTCTTGTTTCTGTGCTTAAA	4	1.0	CTGATGAGTGCCGATTGGCCATGTTAGG CTGATGAGTGTCGTATGGCTATGTTAGG CTGATGAGTGTCGTTTAGCTATGTTAGG GATGAGTGTCGTTTGGCCATGTTGGGTG	{1354} {1354} {1354} {1356}
7.447988504066714	9512	9755	243	9512	5	1.0	AGTCTCACAGACTAACATGTGCACTCCGAA AGTTTCACAGACTAACATGCACACACCTAG GGTGTCACAGACTAACATGCATACACCTAG GGTTTCACAGACTAACATGCACACACCTAG GGTTTCACAGACTAATATGCATACACCTAG	9725	3	1.0	CATGCACCAAATTGAGTTAGGAAGCGGTAG CATGCATCAGATTGAACTCGGAAGTGGTAG TATGCATCAAATTGAACTCGGAAGTGGTAG	4	1.0	ATCTTAGAGGTAGCGAGGTTGAGTTTTG TGGTTGTGCTCAAGGTGTCTTTGGTGTA TGGTTGTGCTCAAGGTGTTTTTGGTGTG TTTCGGTGTGAACATGAGGACCAATTGG	{9694} {9599} {9599} {9617}
7.4910405378427525	1860	2068	208	1860	4	1.0	ACAGCTGTTGTTGGTTCCACTGAAGAAGTT ACGACTGTGGTGGGTTCTACAGAGGACGTT ACTGCTATTGTTGGTTCTACTGAGGATGTT ACTGCTGTTGTTGGTTCTACCGAAGATGTT	2038	4	1.0	GCGTTCTGACTACTGCTGTCTACAAACCAC GTGTGTTGACTACTGCAGTCTACAAACCAT GTGTGTTGACTACTGCAGTCTATAAACCAT GTGTTTTGACCACAGCTGTTTACAAACCTC	5	1.0	AACTTTCTAGTGAAGGGTATACTGTTGT CGTAATTGGCGATGTGGCGTACTTTGTT GTCTTCGCGTGTGGAGCGTAGTACAGCT TACTGCTGTGGTTGACGGGATAGCGTAT TGGCTTACTTTGTTAGTGAAGGCTACTT	{1948} {1973} {1892} {1967} {1987}
7.609353964378334	26638	26805	167	26638	5	1.0	GCCATAGCCACACTTATTATGTGGGTTATG GCCGTATCAACACTCATTATGTGGGTGATG GCCGTATCAACACTCGTTATATGGGTGATG GCCGTATCAACACTCGTTATGTGGGTTATG GCTATAGCCACATTTGTTATGTGGGTTATG	26775	4	1.0	CCAACCCACACAACAAGCGCCTACAGGCAT CCAACCCATTCAACAAGCTCCAACAGGCAT CCAACCTACTCAACAAGCGCCTACAGGGAT CCAACCTACTCTACAAGCCCCCACAGGGAT	1	1.0	GACGTGCTCGAACTTTTTGGGCATGGAA	{26696}
7.614979969342406	27156	27293	137	27156	5	1.0	AACCCCTTGCTTGTCGAAAATGGCCAACCT AGACCTTTGCTTGTCGACAATGACCAGCCT AGCCCTTTGCTTGTTGACAATGATCAACCT AGCCCTTTGCTTGTTGATAGTGAACAACCT AGTCCTTTGCTTGTTGACAGCGAACAACCT	27263	4	1.0	AAAACGCTTCAGAACTAAGAAAGGTCAGAG AAAACGCTTCAGAACTCGTAAAGGGCAGCG AAAACGTTTCAGAACTAGAAAGGGCAAACG GAAAAGATTCCGCACTAGGAAGGGCAAGAA	2	1.0	TGGAAAGTGATACCTCGTGACTTGGTAC TGGAAGGTGATACCTCGTAATTTGGTAC	{27186} {27186}
7.757211090344212	8585	8705	120	8585	5	1.0	ATTCTCTATTGCTGCAATGTCAGGCCAAAT ATTCTCTGTTGCTGCAATGTCAGGTCAAAT ATTTTCTGTTGCCGCAATGTCAGGTCAAAT ATTTTCTGTTGCTGCAATGTCAGGCCAAAT GTTCTCTGTAGCCGCAATGTCAGGTCAGAT	8675	4	1.0	TAGACGCATGTTTGGCGATCTTTCTGTAGG TAGACGCATGTTTGGTGACCTTTCTGTAGG TAGACGCATGTTTGGTGATTTGTCTGTAGG TAGACGTATGTTTGGTGATCTTTCTGTGGG	4	1.0	CGTAGGTGCCTTTGTTATACTTTGTTGT GTGCATTAGGTGCTTTTGTCATCTTTTG TGCATTAGGTGCTTTTGCCATCTTTTGT TTCGCAATCTTTTGTTGTTTTCTCGTGA	{8630} {8626} {8627} {8640}
7.77963196905215	842	993	151	842	4	1.0	TGCTTTGCATACACTACGCAACGGTTCTGT TGCTTTGCATACACTACGCAATGGTTCTGT TGCTTTGCATACACTGCGTAATGGTTCTGT TGCTTTGCATACGTTGCGCAATGGTTCTGT	963	5	1.0	ATGACAAATGGTTCCAACATCCTAGAGGCC ATGACAAATGGTTCTAACATCTTAGAGGCC ATGACCAATGGTTCTAACATCTTAGAGGCT ATGACCAATGGTTCTACCATTTTGGAGGCC ATGACTAATGGTTCCAACATCTTAGAGGCC	3	1.0	GAGGCCAAAATATCCAGTAAGGTGGTGT GTAAAGTGGTGTTAAGTGCTGAGCTTGA TCTCGAAACGGCGAAGGAAGTGAAGACA	{888} {904} {872}
7.7853265909416205	8417	8608	191	8417	4	1.0	CATCGCTACTAAGTACTGTAGAGTTGGTGA TATTGCTACCAAATACTGCCGCGTAGGTGA TATTGCTACCAAATATTGCCGTGTAGGTGA TGTAGCAACCAAGTACTGCCGTGTAGGTGA	8578	5	1.0	CATCCTCATTTTCTGTTGCCGCAATGTCAG CATCTTCATTTTCTGTTGCTGCAATGTCAG CATGTTCATTTTCTGTAGCTGCAATGTCAG CATTATCGTTCTCTGTAGCCGCAATGTCAG CGTCCTCATTCTCTATTGCTGCAATGTCAG	2	1.0	GGTTATGTTTGCGGTACAGGTCTGTGGG GTTATGTTTGTGGTACTGGTTTGTGGAA	{8520} {8521}
7.797334243325825	648	776	128	648	4	1.0	TACCTATGCGGTGCCGATGGCAAACCTGTC TACCTCTGCGGAGCCGATGGCAAACCTGTC TACCTTTGCGGTGCTGATGGAAAACCTGTC TATCTCTGTGGCGCCGATGGCAAACCTGTC	746	5	1.0	CACTTATGTTTGTGCATGGCTTACCAAACG GACGTATGTTTGTGCGTGGCTCACTAAGCG TACCTACGTTTGTGCTTGGCTTACTAAGCG TACTTACGTTTGTGCTTGGCTTACTAAGCG TACTTATGTTTGTGCCTGGCTTACCAAGCG	4	1.0	AATGAAGATTTGTGGCAATTTGTCGACC ATAAATGAAGATTTGTGGCAGTTTGTTG GTGATGATTTATGGCAGTTTGTTGACCA TAAGTGAAGAATTGTGGCAATTTATTGA	{681} {678} {682} {679}
