cost	target-start	target-end	target-length	left-primer-start	left-primer-num-primers	left-primer-frac-bound	left-primer-target-sequences	right-primer-start	right-primer-num-primers	right-primer-frac-bound	right-primer-target-sequences	num-guides	total-frac-bound-by-guides	guide-target-sequences	guide-target-sequence-positions
7.797334243325825	27156	27352	196	27156	5	1.0	AACCCCTTGCTTGTCGAAAATGGCCAACCT AGACCTTTGCTTGTCGACAATGACCAGCCT AGCCCTTTGCTTGTTGACAATGATCAACCT AGCCCTTTGCTTGTTGATAGTGAACAACCT AGTCCTTTGCTTGTTGACAGCGAACAACCT	27322	4	1.0	ACTACCTTGGAACAGGTCCCTACCCAGATG ACTATTTGGGCACAGGACCACATAAGGAAT ATTATCTTGGCACAGGACCCCATAAAGATG ATTATTTGGGCACAGGACCGCATCAAGATG	2	1.0	TGGAAAGTGATACCTCGTGACTTGGTAC TGGAAGGTGATACCTCGTAATTTGGTAC	{27186} {27186}
7.8836079683607325	27114	27352	238	27114	5	1.0	CAGCAGCGTGGTCGTCAGGCTAGAATCCCT CCACAACGTGGTCGTCAGAGTAGAATACCT CCACAACGTGGTCGTCAGGGCAGAATACCT CCACAACGTGGTCGTTCAGGCAGAATCCCT CCACGGCGTGGTCGTTCGGGAAGAATTCCA	27322	4	1.0	ACTACCTTGGAACAGGTCCCTACCCAGATG ACTATTTGGGCACAGGACCACATAAGGAAT ATTATCTTGGCACAGGACCCCATAAAGATG ATTATTTGGGCACAGGACCGCATCAAGATG	2	1.0	TGGAAAGTGATACCTCGTGACTTGGTAC TTGGAAGGTGATACCTCGTAATTTGGTA	{27186} {27185}
8.105807968360732	434	672	238	434	5	1.0	AGATTTGCAGGATTGCATCGTTGGCATTGC TGGCTTGCACGATTGTGTTGTTGGCATTGC TGGCTTGCATGATTGCGTTGTTGGCATTGC TGGTTTGCAAGATTGCGTCGTTGGTGTTGC TGGTTTGCAAGATTGCGTTGTTGGCATTGC	642	4	1.0	GACCAATACCTCTGCGGAGCCGATGGCAAA GACCAATACCTTTGCGGTGCCGATGGAAAA GACCAGTATCTCTGTGGCGCCGATGGCAAA GATCAATACCTATGCGGTGCCGATGGCAAA	4	1.0	ATGATACATATGTTATGGGTCTGCATGG CCCTTTATGCTTAGAGGGTGGTTGGTGT TCCCTTTATGCTTCGTGGTTGGTTGGTT TGGTTTGCAACTTGATGAAGTTTTCTGA	{466} {537} {536} {505}
8.116435466635869	5506	5750	244	5506	5	1.0	CAGCATGGAATAAGTTTGTCCTTGGAGATG CTGCATGGAACAAATTTGTTTTAGGCGATG CTGCATGGAATAAGTTTGTTCTCGGTGATG CTGCATGGAATAAGTTTGTTTTAGGCGATG CTGCGTGGAATAAATTTGTTTTAGGCGATG	5720	4	1.0	CTCTGCAATAGTATGTGCTGGTGTTAAACG CTCTGCCATAGTTTGTGCTAGTGTTAAACG TTCTGCTATAGTTTGTGCTAGTGTCAAACG TTCTGTTATAGTCTGTGCTAGTGTCAAACG	4	1.0	GCCGGACTTGTAAAGGGTTCTAAGGGTG GTAGCATTTGTGTATCACGTAGCGGGGT TTATAGTTCTTGTGTTGAATGTGAAGTT TTGTTGCATTTGTTTACTATGTTGCAAG	{5568} {5547} {5663} {5545}
8.232719948987032	1821	2068	247	1821	5	1.0	GGCGTTCGCGCAAGTGGCCTTAAAACAGTT GGCGTTCGTGAAAGTGGTCTTAACAAAGTT GGTAGTCGTGAAAATGGCCTTACTACTGTA GGTGTTCGTGAAAGTGGCATTAACAAAGTT GGTGTTCGTGAAGGTGGCCTTAATAAAGTT	2038	4	1.0	GCGTTCTGACTACTGCTGTCTACAAACCAC GTGTGTTGACTACTGCAGTCTACAAACCAT GTGTGTTGACTACTGCAGTCTATAAACCAT GTGTTTTGACCACAGCTGTTTACAAACCTC	5	1.0	AACTTTCTAGTGAAGGGTATACTGTTGT CGTAATTGGCGATGTGGCGTACTTTGTT GTGGTGGGTTCTACAGAGGACGTTAAGT TACTGCTGTGGTTGACGGGATAGCGTAT TGGCTTACTTTGTTAGTGAAGGCTACTT	{1948} {1973} {1866} {1967} {1987}
8.333499999999999	1607	1731	124	1607	5	1.0	CGCTGCTGTTGCTGTTGTCAATGGTTCTAT TTCAGCTGTTGCTGTCGTGGGTGGTACTAT TTCAGCTGTTGCTGTTGTAGGTGGTACTAT TTCAGCTGTTGCTGTTGTGAGTGGTACTAT TTCAGCTGTTGCTGTTGTGGATGGTGCCAT	1701	5	1.0	AGGACGATGTTTGAGTGTGCGGCTGACAAG CAAACTGTCTTTGACTGTGCTGTTGAAACT CAAACTGTCTTTGATTGTGCTGTTGAAACC CAAACTGTTTTTGACTGTGCTGTTGAGACC CAGACTGTCTTTGCTTGTGCTGTTGAAACC	3	1.0	TGAAAAGTTTTTGAATGCATTTGATGTG TGAGAAGTTTTTGAATGCGTTTGACGTG TGCTTTTGACGTGTTTGTCAAAGCTGTG	{1658} {1658} {1673}
8.541174392180881	1279	1512	233	1279	5	1.0	CTTCTGCCACTTTTGTGGAAGAAGAACATG CTTCTGCTACCTTTGTAGAAGAGGAACATG CTTCTGCTACTTTTGTAGAGGAGGAACATG CTTCTGCTGATTATGTAGAGGAGGACCACC CTTCTTCCACTTTTGTAGAAGAGGAACATG	1482	5	1.0	AAACCATGGTTCGTTCGCAAAGCCGAAGAC AAACCATGGTTTGTGCGTAAGGCAGAGGAC AAACCATGGTTTGTTCGCAAGGCTGAAGAC AAACCCTGGTTTGTGCGCAAGGCTGAAGAT AAACCGTGGTTTGTTCGCAAGGCTGAAGAT	2	1.0	GAATGGACACATTCTGTTTCAATGTACG GAATGGATACATTCTGCTTCAATGTACG	{1315} {1315}
8.621164730403718	1607	1824	217	1607	5	1.0	CGCTGCTGTTGCTGTTGTCAATGGTTCTAT TTCAGCTGTTGCTGTCGTGGGTGGTACTAT TTCAGCTGTTGCTGTTGTAGGTGGTACTAT TTCAGCTGTTGCTGTTGTGAGTGGTACTAT TTCAGCTGTTGCTGTTGTGGATGGTGCCAT	1794	5	1.0	GTAAAACTTGTCACCACAAAGCTTAAGGGT GTAAAACTTGTCACCATAAAGCTTAAGGGC GTCAAACTCGTAAGCTCAAAGCTCAAAGGT GTCAAATTTGTCACCACTAAGCTTAAAGGC GTCAAATTTGTTACCACTAAGCTTAGAGGC	3	1.0	TGAAAAGTTTTTGAATGCATTTGATGTG TGAGAAGTTTTTGAATGCGTTTGACGTG TGCTTTTGACGTGTTTGTCAAAGCTGTG	{1658} {1658} {1673}
8.646666666009796	763	993	230	763	5	1.0	GGCTCACTAAGCGTAAGCCTCTGGATCACA GGCTTACCAAGCGTAAACCATTAGAGTATA GGCTTACTAAACGTAAACCATTGCCATACA GGCTTACTAAGCGCAAGCCTTTAGATTACA GGCTTACTAAGCGTAAGCCCTTAGATTACA	963	5	1.0	ATGACAAATGGTTCCAACATCCTAGAGGCC ATGACAAATGGTTCTAACATCTTAGAGGCC ATGACCAATGGTTCTAACATCTTAGAGGCT ATGACCAATGGTTCTACCATTTTGGAGGCC ATGACTAATGGTTCCAACATCTTAGAGGCC	3	1.0	TCTCGAAACGGCGAAGGAAGTGAAGACA TTCTGTTCTTGAAACGGCTAAGGATTTG TTGGCTATAGAGGAAATAGAATACGTGC	{872} {866} {807}
8.677219948987032	11615	11862	247	11615	5	1.0	CAAACTCGTCGTTGTAGTACCAGATCATGA CAAGCTCGTCGTCGTGGTGCCAGATCATGA CAAGCTTGTTGTTGTAGTACCAGATCATGA CAAGCTTGTTGTTGTAGTGCCAGATTATGA CAGGCTCGTCGTCGTAGTGCCAGATCATGA	11832	5	1.0	ATAATGCCAGGCAAGATGAAGGTCAAGGCC ATAATGCCAGGTAAAATGAAGGTCAAAGCC ATAATGCCAGGTAAAATGAAGGTTAAGGCC ATAATGCCAGGTAAGATGAAAGTCAAAGCC ATAATGCCGGGCAAGATGAAGGTTAAAGCC	3	1.0	AAATGATGGTAGATGGTTTTGTGCACTA GCAGGTGTTGTTTGGACTTTACAAGAAG TTTGCGAGAATGATGGTAGATGGTTTTG	{11656} {11685} {11649}
8.682321916171135	7789	8039	250	7789	5	1.0	CTAAACAAGGTGCTGGAAAGACTGGCCGTT CTAAACAAGGTGCTGGCAAGACTGGACACT CTAAGCAAGGTGCTGGTGATGCTGGCCATT CTAAGCAAGGTGCTGGTGATGCTGTTCATT CTAAGCAAGGTGCTGGTGATTCTGGCCGTT	8009	5	1.0	TAATGAGTGGCATTATGCTAGGTTTGGTTC TGAGGAATGGCATTATGCTAAGTTTGGTTC TGAGGACTGGCATTATGCTAAGTTTGGCTC TGAGGATTGGCATTATGCTAAGTTTGGCTT TGATGACTGGTATTACTCTAAGTTTGGGTC	3	1.0	GGTTTTGGCTACTTTGTGGTTTTATGTG GTACGATACTGTACATAGTTTTGAAGGG TGGTCTTGTGTGTTTGATTCAATTCTAT	{7828} {7898} {7844}
8.70007380995394	2795	2997	202	2795	5	1.0	CATGCCAATTGCAGACCCTACACATTTTGA CCTACCTATTTCTGACCCAACACATTTTGA CTTACCCATTGCAGACCCTACACATTTTGA CTTACCTATTGCTGACCCAACACATTTTGA TCTACCTATCGCTGATCCAACACATTTTGA	2967	5	1.0	TTTACAAAAGCCGCTGGTGGTAAAGTTTCA TTTACAAAATCCGCTGGTGGTAAGGTTTCA TTTACTAAAGCCGCCGGTGGTAAAGTTTCT TTTACTAAAGCCGCTGGTGGCAAAGTTTCT TTTACTAAGGCTGCCGGTGGCAAAGTTTCT	4	1.0	GAACCAGGTTGTGGTGGTATTTTGGCAT GAGGAGGTTCAACTTCTTGACACAGAAT TGAAGAAGTTGAACTTTTAGATGCAGAG TTGAACCAGGTTGTGGCGGTATCTTGGT	{2862} {2829} {2828} {2860}
8.720453964378335	1554	1721	167	1554	5	1.0	CAACTCAATGTTACAACAGGTGAGTTGATG CAACTTAAAGTCACTACAGGTGAACTTGTG CAGCTTAAAGTCACTACAGGTGAACTTATG CAGCTTAAAGTTACCACAGGTGAACTTATG CAGCTTAAAGTTACTACAGGTGAACTCATG	1691	5	1.0	CAAAGCTGTGCAAACTGTTTTTGACTGTGC CAAAGCTGTTCAAACTGTTTTTGACTGTGC CAAAGCTGTTCAGACTGTCTTTGCTTGTGC CACAACTATTCAAACTGTCTTTGACTGTGC TAGTGCCGTTAGGACGATGTTTGAGTGTGC	5	1.0	AGGTTTGTTAAGTCTATTTGCAGTTCAG AGTGTACCTGAGAAGTTTCTGGCTGCTT TGAAAAGTTTTTGAATGCATTTGATGTG TGAGAAGTTTTTGAATGCGTTTGACGTG TGTGGCTAGTGTGCCTGAGAAATTTTTG	{1584} {1650} {1658} {1658} {1643}
8.757766666009797	546	776	230	546	5	1.0	CTTAGAGGGTGGTTGGTGTTTTCCAACTCA CTTAGAGGGTGGTTGGTTTTTTCTAACTCA CTTCATGGGTGGTTGGTTTTTTCCAATTCA CTTCGTGGTTGGTTGGTTTTTTCCAATTCA TTACGAGGTTGGTTAGTCTTTTCCAACTCA	746	5	1.0	CACTTATGTTTGTGCATGGCTTACCAAACG GACGTATGTTTGTGCGTGGCTCACTAAGCG TACCTACGTTTGTGCTTGGCTTACTAAGCG TACTTACGTTTGTGCTTGGCTTACTAAGCG TACTTATGTTTGTGCCTGGCTTACCAAGCG	4	1.0	AATGAAGATTTGTGGCAATTTGTCGACC ATGTTGTGTTGGGCAGGCGTGGTGGCGG GTGATGATTTATGGCAGTTTGTTGACCA TAAGTGAAGAATTGTGGCAATTTATTGA	{681} {598} {682} {679}
8.759646828807647	1490	1721	231	1490	5	1.0	GTTCGTTCGCAAAGCCGAAGACATCCTAGG GTTTGTGCGCAAGGCTGAAGATATCTTTGG GTTTGTGCGTAAGGCAGAGGACATCTTTGG GTTTGTTCGCAAGGCCGAAGACATCTTTGG GTTTGTTCGCAAGGCTGAAGACATTTTTGG	1691	5	1.0	CAAAGCTGTGCAAACTGTTTTTGACTGTGC CAAAGCTGTTCAAACTGTTTTTGACTGTGC CAAAGCTGTTCAGACTGTCTTTGCTTGTGC CACAACTATTCAAACTGTCTTTGACTGTGC TAGTGCCGTTAGGACGATGTTTGAGTGTGC	4	1.0	AGTGTACCTGAGAAGTTTCTGGCTGCTT GTTGATGTGCTTTGTCAAAAATATATGT TATGAGATTTGTTAAGTCCATCTGCAGT TGTTGGTCTGCTCTTGTTTCTGTGCTTA	{1650} {1577} {1580} {1524}
8.775385737400775	4841	5028	187	4841	5	1.0	CGCACTTAATGGCGCACTTGTTGCTGCTAC CGCACTTAATGGTGTCCTTAGTGCTGCCAT TGCACTTAATGGAATGCTTAGTGCTGCCAT TGCACTTAATGGAGCACTTAGTGCTGCTAT TGCACTTAATGGTGTGCTTAGTGCTGCTAT	4998	5	1.0	CAACGATGCACACGTAAGTTGAATAGACTT CAACGGTGCACGCGTAAGCTGAATAGACTT CAACGGTGTACACGTAAGCTGAATAGACTT CAGAGGTGTACACGTAAGTTAAATAGGCTT CAGCGATGTACACGTAAGTTGAATAGACTT	5	1.0	TAGGTTCTGTTGTAGTCTACATGTGTGT TCATCTGTTGTTGTTTACATGTGTGTTG TGATATTGGTTCAACCGTGGTTTACATG TTAAGTTTGACATAGAGTCTGTTGTTGT TTAAGTTTGATATAGGTTCTGTTGTTGT	{4930} {4932} {4925} {4918} {4918}
8.781388504066713	8585	8828	243	8585	5	1.0	ATTCTCTATTGCTGCAATGTCAGGCCAAAT ATTCTCTGTTGCTGCAATGTCAGGTCAAAT ATTTTCTGTTGCCGCAATGTCAGGTCAAAT ATTTTCTGTTGCTGCAATGTCAGGCCAAAT GTTCTCTGTAGCCGCAATGTCAGGTCAGAT	8798	5	1.0	CTTCTTTGCCACACGTCAATTGCATTATGC CTTCTTTGCTACTAGAAGTTTGCGCTACGC TTTCTTTGCAACCAGAAGCTTACGGTACGC TTTCTTTGCTACTAGAAACCTACGCTATGC TTTCTTTGCTACTAGAAGCTTACGCTATGC	4	1.0	CGTAGGTGCCTTTGTTATACTTTGTTGT GTGCATTAGGTGCTTTTGTCATCTTTTG TGCATTAGGTGCTTTTGCCATCTTTTGT TTCGCAATCTTTTGTTGTTTTCTCGTGA	{8630} {8626} {8627} {8640}
8.85929679600542	4803	5028	225	4803	5	1.0	ATGCTTACTTTGGATGACCGTGGTTTAGCT GTCTTAACTTTAGATGACCATGGTGTGGCT GTGCTTAATTTGGATGATCATGGTCTGGCT GTGCTTACTTTGGATGACCATGGTTTAACC TTGCTTACCTTAGATGACTATGGTCGTGTT	4998	5	1.0	CAACGATGCACACGTAAGTTGAATAGACTT CAACGGTGCACGCGTAAGCTGAATAGACTT CAACGGTGTACACGTAAGCTGAATAGACTT CAGAGGTGTACACGTAAGTTAAATAGGCTT CAGCGATGTACACGTAAGTTGAATAGACTT	5	1.0	TAGGTTCTGTTGTAGTCTACATGTGTGT TCATCTGTTGTTGTTTACATGTGTGTTG TGATATTGGTTCAACCGTGGTTTACATG TTAAGTTTGACATAGAGTCTGTTGTTGT TTAAGTTTGATATAGGTTCTGTTGTTGT	{4930} {4932} {4925} {4918} {4918}
8.944089493487166	3770	3982	212	3770	5	1.0	TGGTACGTGTCTGAATTGTAACGCACCGCG TGGTACTTGTCTAAATTGTAATGCACCTCG TGGTACTTGTCTTAATTGTAATGCACCACG TGGTGTCTGCTTTAATTGTAAGGCGCCTCG TGGTGTTTGTCTCAATTGCAAAGCACCGCG	3952	5	1.0	CACAAAAACTGTGTGTTGATGGTTTTGGTG CACAAAAGTTATGTGTGGATGGTTTTGGTG CACAAAATTTGTGTGTGGATGGTTTTGGTG CGCAAAAATTGTGTATAGATGGTTTCGGTG CGCAAAAGTTGTGTGTGGATGGTTTTGGTG	6	1.0	ATTTGTGCATCTGTGTTCCGGGGCGCCG CATCTGTGTTCCGTGGTGATTTGTCTTG CTCATCAATTTTTCGTGGTGCTGTGTCT TGTGCTTTTGTCGTTAAACCAGTTTGTG TTAGGCAGTTGCAAGGTACAATAATTTT TTTGTGCAGCAGGAGCCAGTGCCTGTAA	{3891} {3898} {3896} {3870} {3811} {3837}
